N205,all,N205_dup_3p_middle,3,False,RPSA,ARF4,"RPSA, MOBP, MYRIP, EIF1B, ENTPD3-AS1, ENTPD3, RPL14, ZNF619, ZNF620, ZNF621, AC099560.1, AC099541.1, CTNNB1, ULK4, TRAK1, CCK, LYZL4, VIPR1, VIPR1-AS1, SEC22C, SS18L2, NKTR, AC006059.1, ZBTB47, CCDC13, CCDC13-AS1, AC099329.3, LINC02158, HIGD1A, AC099329.1, ACKR2, AC092042.3, KRBOX1, CYP8B1, ZNF662, KRBOX1-AS1, FAM198A, POMGNT2, AC092042.1, SNRK, AC104184.1, SNRK-AS1, ANO10, ABHD5, AC006058.2, AC006058.3, AC006058.1, TOPAZ1, AC104187.1, TCAIM, LINC01988, ZNF445, ZNF852, ZKSCAN7, AC099669.1, ZNF660, ZNF197, ZNF197-AS1, ZNF35, AC124045.1, ZNF502, ZNF501, KIAA1143, KIF15, TMEM42, TGM4, ZDHHC3, EXOSC7, CLEC3B, CDCP1, TMEM158, LARS2, LARS2-AS1, LIMD1, SACM1L, SLC6A20, LZTFL1, CCR9, FYCO1, CXCR6, XCR1, CCR3, CCR1, CCR2, AC098613.1, CCR5, CCRL2, LINC02009, LTF, RTP3, LRRC2, LRRC2-AS1, TDGF1, FAM240A, ALS2CL, TMIE, PRSS50---1, PRSS45, AC109583.3, PRSS42, MYL3, PTH1R, CCDC12, NBEAL2, SETD2, KIF9-AS1, KIF9, KLHL18, AC099778.1, PTPN23, SCAP, ELP6, CSPG5, SMARCC1, DHX30, MAP4, CDC25A, CAMP, ZNF589, NME6, SPINK8, FBXW12, PLXNB1, CCDC51, TMA7, AC134772.1, ATRIP, TREX1, SHISA5, PFKFB4, UCN2, COL7A1, UQCRC1, TMEM89, SLC26A6, CELSR3, LINC02585, AC141002.1, NCKIPSD, IP6K2, PRKAR2A, PRKAR2A-AS1, SLC25A20, ARIH2OS, ARIH2, AC137630.2, AC137630.1, AC137630.4, P4HTM, WDR6, DALRD3, NDUFAF3, IMPDH2, AC137630.3, QRICH1, QARS, USP19, LAMB2, CCDC71, KLHDC8B, CCDC36, AC121247.1, C3orf62, USP4, RHOA, TCTA, AMT, AC104452.1, NICN1, DAG1, BSN-DT, BSN, BSN-AS1, APEH, MST1, RNF123, AMIGO3, GMPPB, IP6K1, CDHR4, INKA1, UBA7, TRAIP, CAMKV, MST1R, AC105935.1, MON1A, RBM6, RBM5, RBM5-AS1, SEMA3F-AS1, SEMA3F, GNAT1, SLC38A3, GNAI2, U73166.1, SEMA3B-AS1, SEMA3B, LSMEM2, IFRD2, HYAL3, NAA80, HYAL1, HYAL2, TUSC2, RASSF1, RASSF1-AS1, ZMYND10-AS1, ZMYND10, NPRL2, CYB561D2, TMEM115, CACNA2D2, CYB561D2---1, C3orf18, HEMK1, AC096920.1, CISH, MAPKAPK3, LINC02019, DOCK3, MANF, RBM15B, DCAF1, RAD54L2, TEX264, GRM2, IQCF1, RRP9, PARP3, GPR62, PCBP4, ABHD14B, ABHD14A, ABHD14A-ACY1, ACY1, RPL29, DUSP7, POC1A, ALAS1, TLR9, TWF2, AC006252.1, PPM1M, WDR82, GLYCTK, DNAH1, BAP1, PHF7, SEMA3G, TNNC1, NISCH, STAB1, NT5DC2, SMIM4, PBRM1, GNL3, GLT8D1, SPCS1, NEK4, ITIH1, ITIH3, ITIH4, AC006254.1, ITIH4-AS1, MUSTN1, TMEM110-MUSTN1, STIMATE, SFMBT1, AC096887.1, RFT1, PRKCD, TKT, DCP1A, CACNA1D, AC012467.1, CHDH, IL17RB, AC012467.2, ACTR8, SELENOK, CACNA2D3, LRTM1, AC121764.2, WNT5A, WNT5A-AS1, AC121764.1, ERC2, AC025572.1, CCDC66, FAM208A, ARHGEF3, SPATA12, AC097358.2, IL17RD, HESX1, APPL1, ASB14, DNAH12, PDE12, ARF4","RPSA, EIF1B, RPL14, CTNNB1, SS18L2, NKTR, ZNF445, KIAA1143, SACM1L, CCDC12, SETD2, SMARCC1, DHX30, MAP4, TMA7, UQCRC1, IP6K2, ARIH2, WDR6, NDUFAF3, IMPDH2, QARS, RHOA, INKA1, RBM6, RBM5, GNAI2, RASSF1, MAPKAPK3, ABHD14B, RPL29, WDR82, PBRM1, GNL3, SPCS1, TKT, SELENOK, CCDC66, FAM208A, APPL1, ARF4",301.0,41.0,the fluctuating pattern in chromosome 3 is very suspicious. could this be some form of regional transcriptional regulation? (keeping this CNA because the number of genes in it is not too small). Liran: this might be inversion 3 it causes a unique gene expression pattern,,,False,True,False,False,False,False,False,False,False,False,False,False,False,False,False,False,False,False,False,False,False,False,False,False,False,False,False,False,True,False,False,False,False,False,False,False,False,False,False,False,False,False,False,False,False,False,False,False,False,False,False,False,False,False,False,False,False,False,False,False,False,False,False,False,False,False,False,False,False,False,False,False,False,False,False,False,39412542.0,57598220.0,False
N205,all,N205_dup_3q_end,3,False,MYNN,LMLN-AS1,"MYNN, LRRC34, AC078795.3, AC078795.2, LRRIQ4, LRRC31, SAMD7, AC008040.1, SEC62, SEC62-AS1, GPR160, PHC3, AC008040.5, PRKCI, AC073288.1, SKIL, AC073288.2, CLDN11, AC026316.5, SLC7A14, RPL22L1, EIF5A2, SLC2A2, TNIK, AC092919.1, PLD1, TMEM212, FNDC3B, GHSR, TNFSF10, LINC02068, NCEH1, ECT2, SPATA16, AC068759.1, NLGN1, NLGN1-AS1, NAALADL2, NAALADL2-AS2, NAALADL2-AS1, LINC01208, AC092920.1, LINC01209, TBL1XR1, TBL1XR1-AS1, LINC00501, AC117465.1, LINC00578, AC026355.1, LINC02015, AC007953.1, AC007953.2, AC109779.1, KCNMB2, KCNMB2-AS1, ZMAT3, AC076966.1, PIK3CA, KCNMB3, ZNF639, AC007823.1, MFN1, GNB4, AC007620.2, AC007620.3, ACTL6A, AC090425.2, AC090425.1, MRPL47, NDUFB5, USP13, PEX5L, AC007687.1, PEX5L-AS1, LINC02053, AC125618.1, TTC14, CCDC39, CCDC39---1, AC108734.4, FXR1, DNAJC19, AC022294.1, AC125613.1, SOX2, LINC01206, LINC01994, LINC02031, AC083801.2, AC069431.1, ATP11B, AC092953.2, DCUN1D1, MCCC1, MCCC1-AS1, LAMP3, MCF2L2, B3GNT5, KLHL6, KLHL6-AS1, KLHL24, YEATS2, YEATS2-AS1, AC131160.1, MAP6D1, PARL, ABCC5, ABCC5-AS1, HTR3D, HTR3C, HTR3E-AS1, HTR3E, AC131235.4, AC131235.3, EIF2B5, DVL3, AP2M1, ABCF3, VWA5B2, ALG3, EEF1AKMT4, EEF1AKMT4-ECE2, CAMK2N2, PSMD2, EIF4G1, FAM131A, CLCN2, POLR2H, CHRD, LINC02054, LINC01840, EPHB3, MAGEF1, AC107294.2, AC107294.3, AC107294.1, LINC02069, VPS8, C3orf70, EHHADH-AS1, EHHADH, MAP3K13, TMEM41A, LIPH, SENP2, IGF2BP2, IGF2BP2-AS1, TRA2B, ETV5, ETV5-AS1, DGKG, LINC02052, CRYGS, TBCCD1, DNAJB11, AC068631.1, AHSG, HRG, KNG1, AC112907.3, EIF4A2, RFC4, AC112907.1, LINC02043, ADIPOQ, ADIPOQ-AS1, ST6GAL1, RPL39L, RTP1, MASP1, AC007920.2, RTP4, LINC02041, AC072022.1, BCL6, LINC01991, LPP-AS2, LPP, LPP-AS1, TPRG1-AS1, TPRG1, TP63, P3H2, P3H2-AS1, CLDN1, CLDN16, TMEM207, IL1RAP, GMNC, OSTN, OSTN-AS1, UTS2B, CCDC50, AC073365.1, PYDC2, AC026320.1, FGF12, FGF12-AS2, FGF12-AS3, MB21D2, HRASLS, ATP13A5, ATP13A5-AS1, ATP13A4, ATP13A4-AS1, OPA1, OPA1-AS1, LINC02038, LINC02026, AC080129.1, AC080129.2, HES1, LINC02036, LINC02037, LINC00887, LRRC15, GP5, ATP13A3, LINC00884, TMEM44-AS1, TMEM44, AC046143.1, AC046143.2, LSG1, FAM43A, LINC01968, LINC01972, AC090505.2, XXYLT1, XXYLT1-AS1, XXYLT1-AS2, ACAP2, PPP1R2, AC069213.1, APOD, AC233280.1, MUC20-OT1, MUC20, MUC4, LINC01983, TNK2, TNK2-AS1, AC124944.1, TFRC, LINC00885, ZDHHC19, SLC51A, PCYT1A, AC069257.3, AC069257.1, TCTEX1D2, TM4SF19-TCTEX1D2, TM4SF19-AS1, TM4SF19, UBXN7, UBXN7-AS1, RNF168, AC117490.2, SMCO1, WDR53, FBXO45, LINC01063, NRROS, PIGX, CEP19, PAK2, SENP5, NCBP2, NCBP2-AS1, NCBP2-AS2, PIGZ, MELTF, MELTF-AS1, DLG1, DLG1-AS1, AC128709.2, AC128709.1, AC128709.3, LINC02012, BDH1, AC024560.3, AC024560.1, RUBCN, FYTTD1, AC055764.2, LRCH3, AC055764.1, IQCG, RPL35A, LMLN, LMLN-AS1","SEC62, PHC3, RPL22L1, TNFSF10, TBL1XR1, PIK3CA, GNB4, ACTL6A, MRPL47, NDUFB5, TTC14, FXR1, DNAJC19, DCUN1D1, KLHL6, KLHL24, AP2M1, PSMD2, EIF4G1, POLR2H, MAP3K13, IGF2BP2, TRA2B, EIF4A2, LPP, OPA1, LSG1, ACAP2, PPP1R2, MUC20-OT1, TFRC, UBXN7, RNF168, PAK2, NCBP2, NCBP2-AS2, DLG1, FYTTD1, LRCH3, RPL35A",291.0,40.0,the fluctuating pattern in chromosome 3 is very suspicious. could this be some form of regional transcriptional regulation? (keeping this CNA because the number of genes in it is not too small). Liran: this might be inversion 3 it causes a unique gene expression pattern,,,False,True,False,False,False,False,False,False,False,False,False,False,False,False,False,False,False,False,False,False,False,False,False,False,False,False,False,False,False,True,False,False,False,False,False,False,False,False,False,False,False,False,False,False,False,False,False,False,False,False,False,False,False,False,False,False,False,False,False,False,False,False,False,False,False,False,False,False,False,False,False,False,False,False,False,False,169789716.0,198039234.0,False
N205,all,N205_dup_8,8,True,OR4F21,C8orf33,,"ERICH1, MCPH1, AGPAT5, FDFT1, CNOT7, PCM1, ASAH1, INTS10, POLR3D, SLC25A37, ADAM28, PPP2R2A, BNIP3L, DPYSL2, CLU, CCDC25, HMBOX1, SARAF, LEPROTL1, EIF4EBP1, ASH2L, LSM1, NSD3, TACC1, GOLGA7, KAT6A, IKBKB, VDAC3, SMIM19, HOOK3, FNTA, HGSNAT, PRKDC, UBE2V2, PCMTD1, RB1CC1, TCEA1, LYPLA1, MRPL15, TGS1, LYN, RPS20, CHCHD7, SDCBP, AC090152.1, RAB2A, ASPH, ARMC1, PDE7A, SGK3, COPS5, CSPP1, ARFGEF1, TRAM1, TERF1, RPL7, ELOC, FABP5, IMPA1, ZFAND1, C8orf59, RMDN1, CPNE3, NBN, DECR1, OTUD6B-AS1, RBM12B, VIRMA, TP53INP1, UQCRB, MTDH, LAPTM4B, RPL30, COX6C, POLR2K, RNF19A, PABPC1, YWHAZ, ZNF706, UBR5, AZIN1, BAALC, DCAF13, OXR1, ANGPT1, EIF3E, ENY2, EBAG9, EIF3H, UTP23, RAD21, MRPL13, ZHX1, FAM91A1, TMEM65, TATDN1, NDUFB9, SQLE, MYC, FAM49B, PHF20L1, SLA, CHRAC1, AGO2, EEF1D, PUF60, CYC1, MAF1, VPS28, RPL8, C8orf33",1123.0,111.0,,,,False,True,False,False,False,False,False,False,False,False,False,False,False,False,False,False,False,False,False,False,False,False,False,False,False,False,False,False,False,False,False,False,False,False,False,False,False,False,False,False,False,False,False,False,False,True,False,False,False,False,False,False,False,False,False,False,False,False,False,False,False,False,False,False,False,False,False,False,False,False,False,False,False,False,False,False,167043.0,145056030.0,False
N205,all,N205_del_9q_middle,9,False,BICD2,TRIM14,"BICD2, ZNF484, FGD3, SUSD3, AL451065.1, CARD19, NINJ1, AL390760.1, WNK2, C9orf129, AL583839.2, AL583839.1, FAM120AOS, FAM120A, PHF2, PTPDC1, AL158152.2, AL158152.1, MIRLET7DHG, ZNF169, AL691447.2, MFSD14B, PCAT7, FBP2, FBP1, C9orf3, AL353768.1, FANCC, AL354893.2, AL161729.3, PTCH1, AL161729.2, AL161729.1, AL161729.4, LINC00476, AL354861.3, ERCC6L2, LINC00092, AL449403.1, AL449403.2, HSD17B3, AL160269.1, HSD17B3-AS1, SLC35D2, ZNF367, HABP4, CDC14B, AAED1, AL589843.1, ZNF510, ZNF782, MFSD14C, NUTM2G, CTSV, AL590705.3, AL590705.1, CCDC180, TDRD7, TMOD1, AL162385.1, TSTD2, NCBP1, AL162385.2, XPA, AL445531.1, FOXE1, TRMO, HEMGN, ANP32B, AL354726.1, TRIM14","BICD2, CARD19, FAM120AOS, FAM120A, MFSD14C, XPA, HEMGN, ANP32B",71.0,8.0,"very borderline, as the number of genes is small, and the fluctuating pattern in chromosome 9 is very suspicious. could this be some form of regional transcriptional regulation?",,,True,False,False,False,False,False,False,False,False,False,False,False,False,False,False,False,False,False,False,False,False,False,False,False,False,False,False,False,False,False,False,False,False,False,False,False,False,False,False,False,False,False,False,False,False,False,False,False,False,False,False,False,False,False,False,False,False,False,False,False,False,False,False,False,False,False,False,False,False,False,False,False,False,False,False,False,92764812.0,98119212.0,False
N205,all,N205_dup_11,11,True,AC069287.1,AP001999.1,,"PSMD13, IFITM2, IFITM3, RNH1, TALDO1, RPLP2, POLR2L, CTSD, LSP1, MRPL23, CD81, KCNQ1OT1, NAP1L4, NUP98, RHOG, TRIM22, TAF10, TPP1, EIF3F, RPL27A, IPO7, WEE1, SWAP70, CTR9, EIF4G2, ZBED5, USP47, FAR1, COPB1, PSMA1, C11orf58, RPS13, PIK3C2A, NUCB2, LDHA, TSG101, SVIP, ARL14EP, EIF3M, QSER1, CSTF3, HIPK3, CD59, LMO2, CAPRIN1, CAT, APIP, CD44, TRIM44, C11orf74, API5, TTC17, HSD17B12, CD82, DGKZ, MDK, CKAP5, ARFGAP2, SPI1, PSMC3, CELF1, NDUFS3, FNBP4, SSRP1, TIMM10, UBE2L6, ZFP91, FAM111A, MRPL16, DDB1, TMEM258, FADS1, FTH1, AHNAK, GANAB, UBXN1, TTC9C, POLR2G, TMEM179B, RARRES3, RTN3, COX8A, OTUB1, STIP1, FERMT3, DNAJC4, FKBP2, PPP1R14B, TRMT112, PRDX5, RASGRP2, SF1, ARL2, VPS51, FAU, CAPN1, DPF2, NEAT1, FAM89B, RNASEH2C, CFL1, CTSW, FIBP, CCDC85B, BANF1, SF3B2, PACS1, MRPL11, ZDHHC24, CCS, KDM2A, PPP1CA, AIP, GSTP1, NDUFV1, NDUFS8, KMT5B, PPP6R3, CPT1A, MRPL21, NUMA1, LAMTOR1, FCHSD2, RAB6A, COA4, UCP2, PGM2L1, RNF169, SPCS2, RPS3, UVRAG, THAP12, CLNS1A, RSF1, AAMDC, RAB30-AS1, PCF11, CCDC90B, TMEM126B, TMEM126A, CREBZF, PICALM, HIKESHI, CTSC, CHORDC1, TAF1D, C11orf54, MRE11, ANKRD49, CWC15, SRSF8, SESN3, FAM76B, CEP57, CCDC82, BIRC2, TMEM123, CASP4, CARD16, AASDHPPT, CWF19L2, CUL5, NPAT, ATM, DDX10, RDX, FDX1, C11orf1, NKAPD1, TIMM8B, SDHD, IL18, ZBTB16, REXO2, SIK3, PAFAH1B2, PCSK7, ATP5MG, KMT2A, ARCN1, DDX6, RPS25, TRAPPC4, SORL1, HSPA8, TBRG1, EI24, SRPRA, FLI1, APLP2, ZBTB44, THYN1",1639.0,192.0,,,,False,True,False,False,False,False,False,False,False,False,False,False,False,False,False,False,False,False,False,False,False,False,False,False,False,False,False,False,False,False,False,False,False,False,False,False,False,False,False,False,False,False,False,False,False,False,False,False,False,False,False,True,False,False,False,False,False,False,False,False,False,False,False,False,False,False,False,False,False,False,False,False,False,False,False,False,125927.0,134763810.0,False
N205,all,N205_dup_13,13,True,LINC00408,LINC01054,,"MPHOSPH8, PSPC1, ZMYM5, ZMYM2, MRPL57, MICU2, PARP4, RPL21, GTF3A, MTIF3, POLR1D, FLT3, PAN3, POMP, UBL3, HMGB1, HSPH1, N4BP2L1, N4BP2L2, PDS5B, SPART, EXOSC8, SUPT20H, UFM1, NHLRC3, MRPS31, ELF1, WBP4, AKAP11, EPSTI1, DNAJC15, TSC22D1, GPALPP1, GTF2F2, TPT1, ZC3H13, LCP1, MED4, ITM2B, RB1, FNDC3A, SETDB2, PHF11, EBPL, KPNA3, TRIM13, RNASEH2B, INTS6, WDFY2, VPS36, CKAP2, SUGT1, PCDH9, DIS3, PIBF1, COMMD6, CLN5, FBXL3, MYCBP2, RNF219, RBM26, DNAJC3, IPO5, TM9SF2, TPP2, ARGLU1, TNFSF13B, ANKRD10, PCID2, LAMP1, CDC16, UPF3A",564.0,72.0,,,,False,True,False,False,False,False,False,False,False,False,False,False,False,False,False,False,False,False,False,False,False,False,False,False,False,False,False,False,False,False,False,False,False,False,False,False,False,False,False,False,False,False,False,False,False,False,False,False,False,False,False,False,False,False,False,True,False,False,False,False,False,False,False,False,False,False,False,False,False,False,False,False,False,False,False,False,18907810.0,114333948.0,False
N205,all,N205_dup_14,14,True,POTEM,IGHV7-81,,"CCNB1IP1, OSGEP, APEX1, HNRNPC, SUPT16H, CHD8, TOX4, DAD1, OXA1L, MRPL52, RBM23, PSMB5, ACIN1, C14orf119, PABPN1, DCAF11, PSME1, PSME2, REC8, CHMP4A, NEDD8, GMPR2, SCFD1, HECTD1, ARHGAP5, EAPP, BAZ1A, SRP54, FAM177A1, PPP2R3C, NFKBIA, TRAPPC6B, PNN, MIA2, FKBP3, MIS18BP1, KLHDC2, NEMF, ARF6, SOS2, ATP5S, MAP4K5, NIN, PYGL, TMX1, RTRAF, PSMC6, DDHD1, CNIH1, SOCS4, MAPK1IP1L, KTN1, EXOC5, ACTR10, PSMA3, PSMA3-AS1, ARID4A, TIMM9, KIAA0586, JKAMP, PCNX4, DHRS7, MNAT1, HIF1A, PPP2R5E, ZBTB1, MAX, EIF2S1, VTI1B, RDH11, ZFP36L1, ERH, SRSF5, SYNJ2BP, MED6, PCNX1, RBM25, NUMB, ABCD4, NPC2, ISCA2, YLPM1, MLH3, TMED10, GPATCH2L, TMED8, AHSA1, SPTLC2, SLIRP, SNW1, SEL1L, ZC3H14, FOXN3, PSMC1, NRDE2, CALM1, RPS6KA5, DGLUCY, PPP4R3A, TRIP11, ATXN3, NDUFB1, CPSF2, BTBD7, DDX24, IFI27L2, DICER1, GLRX5, PAPOLA, CCNK, EVL, YY1, PPP2R5C, DYNC1H1, HSP90AA1, RCOR1, EIF5, MARK3, BAG5, ATP5MPL, SIVA1, IGHM, FAM30A",1150.0,123.0,,,,False,True,False,False,False,False,False,False,False,False,False,False,False,False,False,False,False,False,False,False,False,False,False,False,False,False,False,False,False,False,False,False,False,False,False,False,False,False,False,False,False,False,False,False,False,False,False,False,False,False,False,False,False,False,False,False,False,True,False,False,False,False,False,False,False,False,False,False,False,False,False,False,False,False,False,False,18999012.0,106875071.0,False
N211,demux_16_01_22_1,N211_del_5q_middle_demux_16_01_22_1,5,False,SLF1,UBLCP1,"SLF1, MCTP1, AC008534.1, AC012312.1, FAM81B, TTC37, ARSK, GPR150, RFESD, SPATA9, AC008840.1, RHOBTB3, GLRX, AC008592.4, AC008592.5, LINC01554, ELL2, AC104123.1, AC008592.2, MIR583HG, AC099509.1, AC099509.2, PCSK1, CAST, AC020900.1, ERAP1, AC008906.1, AC008906.2, AC009126.1, ERAP2, LNPEP, LIX1-AS1, LIX1, RIOK2, AC008883.1, AC008883.2, LINC01340, LINC02234, RGMB, RGMB-AS1, AC008522.1, CHD1, LINC02062, LINC02113, AC113385.1, AC021086.1, FAM174A, ST8SIA4, SLCO4C1, SLCO6A1, AC099487.1, LINC00491, PAM, GIN1, PPIP5K2, C5orf30, LINC02115, NUDT12, LINC02163, AC091987.1, LINC01950, EFNA5, FBXL17, LINC01023, FER, AC008871.1, AC008467.1, PJA2, AC091917.3, AC012603.1, MAN2A1, TMEM232, SLC25A46, TSLP, AC008572.1, WDR36, CAMK4, AC010468.2, AC010275.1, STARD4, STARD4-AS1, NREP, NREP-AS1, EPB41L4A, EPB41L4A-AS1, AC010261.1, AC010261.2, AC104126.1, EPB41L4A-DT, APC, SRP19, REEP5, DCP2, MCC, AC079465.1, YTHDC2, KCNN2, AC010230.1, TRIM36, AC008494.2, PGGT1B, AC008494.3, CCDC112, FEM1C, TMED7-TICAM2, TICAM2, AC010226.1, TMED7, AC008549.2, CDO1, ATG12, AP3S1, LVRN, ARL14EPL, AC034236.3, AC034236.2, COMMD10, AC018752.1, SEMA6A, SEMA6A-AS1, SEMA6A-AS2, LINC00992, LINC02147, LINC02148, LINC02208, LINC02216, LINC02215, AC093206.1, DTWD2, AC008629.1, DMXL1, TNFAIP8, HSD17B4, FAM170A, AC008574.1, AC113418.1, PRR16, AC114284.1, AC008568.1, SRFBP1, LOX, AC010255.1, ZNF474, AC010255.3, AC010255.2, AC113349.2, SNCAIP, AC113349.1, AC119150.1, AC022101.1, LINC02201, SNX2, SNX24, PPIC, AC106786.2, PRDM6, CEP120, CSNK1G3, LINC01170, AC025465.1, ZNF608, AC112196.1, LINC02240, AC109464.1, AC109471.1, AC010235.1, GRAMD2B, AC093535.1, ALDH7A1, PHAX, TEX43, LMNB1-DT, LMNB1, MARCH3, C5orf63, AC011416.3, MEGF10, AC010424.2, PRRC1, AC010424.3, CTXN3, CCDC192, AC068658.1, LINC01184, SLC12A2, FBN2, SLC27A6, ISOC1, ADAMTS19, AC008591.1, KIAA1024L, CHSY3, HINT1, LYRM7, CDC42SE2, RAPGEF6, FNIP1, MEIKIN, AC026398.1, ACSL6, IL3, CSF2, P4HA2, PDLIM4, SLC22A4, SLC22A5, AC116366.3, AC116366.2, AC116366.1, IRF1, IL5, RAD50, TH2LCRR, IL13, IL4, AC004039.1, KIF3A, CCNI2, SEPT8, SOWAHA, AC004775.1, SHROOM1, GDF9, UQCRQ, LEAP2, AFF4, AC010240.3, ZCCHC10, HSPA4, AC113410.2, AC010307.2, FSTL4, AC010307.3, AC010307.4, C5orf15, VDAC1, AC008608.2, TCF7, SKP1, AC104109.3, PPP2CA, AC104109.2, CDKL3, UBE2B, AC109454.2, CDKN2AIPNL, AC109454.3, AC005355.1, LINC01843, JADE2, SAR1B, SEC24A, CAMLG, DDX46, C5orf24, TXNDC15, PCBD2, CATSPER3, PITX1, C5orf66, AC008406.3, C5orf66-AS2, H2AFY, AC026691.1, DCANP1, TIFAB, AC022092.1, NEUROG1, AC034206.1, CXCL14, SLC25A48, IL9, LECT2, TGFBI, SMAD5-AS1, SMAD5, AC063980.1, AC112178.1, SPOCK1, KLHL3, HNRNPA0, AC106791.2, AC106791.1, MYOT, PKD2L2, FAM13B, AC113382.1, AC113382.2, WNT8A, NME5, BRD8, KIF20A, CDC23, GFRA3, CDC25C, FAM53C, AC104116.1, KDM3B, REEP2, EGR1, ETF1, HSPA9, CTNNA1, AC034243.1, LRRTM2, SIL1, AC011405.1, MATR3, SNHG4, MATR3---1, PAIP2, AC135457.1, SLC23A1, MZB1, PROB1, SPATA24, DNAJC18, ECSCR, SMIM33, TMEM173, UBE2D2, AC113361.1, CXXC5, CXXC5-AS1, AC008667.1, AC008667.3, AC008667.4, PSD2, NRG2, AC008667.2, MALINC1, PURA, IGIP, CYSTM1, PFDN1, HBEGF, AC008438.2, SLC4A9, AC008438.1, ANKHD1, ANKHD1-EIF4EBP3, SRA1, EIF4EBP3, APBB3, SLC35A4, CD14, NDUFA2, TMCO6, IK, WDR55, DND1, HARS, HARS2, ZMAT2, PCDHA1, AC005609.5, PCDHA2, PCDHA3, PCDHA4, PCDHA5, PCDHA6, PCDHA7, PCDHA8, PCDHA9, PCDHA10, AC005609.4, PCDHA11, PCDHA12, PCDHA13, PCDHAC1, AC244517.5, PCDHB1, PCDHB2, PCDHB3, AC244517.1, PCDHB4, PCDHB5, AC244517.11, PCDHB6, AC244517.12, PCDHB7, PCDHB8, PCDHB16, AC244517.6, PCDHB9, AC244517.7, PCDHB10, PCDHB11, PCDHB12, PCDHB13, PCDHB14, PCDHB15, TAF7, SLC25A2, AC005618.1, PCDHGA1, PCDHGA2, PCDHGA3, PCDHGB1, AC005618.3, PCDHGA4, PCDHGB2, PCDHGA5, PCDHGB3, PCDHGA6, PCDHGA7, PCDHGB4, PCDHGA8, PCDHGB5, PCDHGA9, PCDHGB6, PCDHGA10, PCDHGB7, PCDHGA11, AC005618.2, PCDHGA12, PCDHGC3, PCDHGC4, PCDHGC5, DIAPH1, AC008781.2, AC008781.1, HDAC3, RELL2, FCHSD1, ARAP3, AC005753.1, PCDH1, DELE1, PCDH12, AC005740.4, RNF14, AC005740.3, GNPDA1, NDFIP1, SPRY4, FGF1, AC005592.1, LINC01844, ARHGAP26, ARHGAP26-AS1, NR3C1, AC016598.1, HMHB1, YIPF5, KCTD16, AC132803.1, AC137770.1, AC008700.1, PRELID2, GRXCR2, SH3RF2, PLAC8L1, AC091887.1, LARS, AC091959.3, RBM27, POU4F3, TCERG1, GPR151, AC008728.1, PPP2R2B, STK32A, DPYSL3, AC011373.1, JAKMIP2-AS1, JAKMIP2, SPINK1, SCGB3A2, C5orf46, AC011352.1, SPINK5, SPINK6, SPINK13, AC091948.1, SPINK7, SPINK9, FBXO38, AC114939.1, HTR4, ADRB2, SH3TC2, AC116312.1, SH3TC2-DT, ABLIM3, AC012613.1, AC012613.2, AFAP1L1, GRPEL2, GRPEL2-AS1, PCYOX1L, IL17B, AC131025.1, CARMN, CSNK1A1, ARHGEF37, PPARGC1B, PDE6A, SLC26A2, TIGD6, HMGXB3, CSF1R, PDGFRB, CDX1, SLC6A7, CAMK2A, ARSI, TCOF1, CD74, RPS14, NDST1-AS1, NDST1, SYNPO, MYOZ3, AC008453.1, RBM22, DCTN4, SMIM3, IRGM, ZNF300, GPX3, TNIP1, ANXA6, AC008641.1, CCDC69, GM2A, SLC36A3, SLC36A2, SLC36A1, FAT2, AC011337.1, AC011374.1, SPARC, CLMAT3, AC011374.2, ATOX1, AC091982.1, AC091982.3, G3BP1, GLRA1, LINC01933, NMUR2, LINC01470, GRIA1, LINC01861, AC091962.1, FAM114A2, MFAP3, GALNT10, SAP30L-AS1, SAP30L, HAND1, LARP1, FAXDC2, CNOT8, GEMIN5, MRPL22, KIF4B, SGCD, AC025434.1, PPP1R2B, TIMD4, HAVCR1, HAVCR2, AC011377.1, MED7, ITK, FAM71B, AC010609.1, AC009185.1, CYFIP2, FNDC9, AC008676.1, ADAM19, NIPAL4, AC106801.1, SOX30, C5orf52, THG1L, LSM11, CLINT1, AC025437.4, AC025437.3, AC025437.2, LINC02227, AC091979.1, AC091979.2, AC091939.1, EBF1, AC136424.2, AC136424.1, LINC02202, RNF145, AC134043.1, LINC01932, UBLCP1","TTC37, RHOBTB3, GLRX, CAST, LNPEP, CHD1, PPIP5K2, PJA2, NREP, EPB41L4A-AS1, APC, SRP19, DCP2, PGGT1B, ATG12, AP3S1, DMXL1, TNFAIP8, HSD17B4, SRFBP1, SNX2, CSNK1G3, PHAX, HINT1, LYRM7, CDC42SE2, FNIP1, IRF1, UQCRQ, AFF4, ZCCHC10, HSPA4, VDAC1, SKP1, PPP2CA, UBE2B, CAMLG, DDX46, C5orf24, H2AFY, SMAD5, HNRNPA0, FAM13B, BRD8, KDM3B, ETF1, HSPA9, CTNNA1, SIL1, PAIP2, MZB1, TMEM173, UBE2D2, CXXC5, PURA, PFDN1, NDUFA2, IK, ZMAT2, TAF7, DIAPH1, NDFIP1, NR3C1, LARS, TCERG1, CSNK1A1, CD74, RPS14, RBM22, ANXA6, CCDC69, ATOX1, G3BP1, LARP1, CNOT8, MRPL22, CYFIP2, CLINT1, RNF145, UBLCP1",596.0,80.0,,,,True,False,False,False,False,False,False,True,False,False,False,False,False,False,False,False,False,False,False,False,False,False,False,False,False,False,False,False,False,False,False,False,False,False,False,False,False,False,False,False,False,False,False,False,False,False,False,False,False,False,False,False,False,False,False,False,False,False,False,False,False,False,False,False,False,False,False,False,False,False,False,False,False,False,False,False,94739436.0,159286040.0,True
N212,all,N212_del_5q_middle,5,False,C5orf15,LRRTM2,"C5orf15, VDAC1, AC008608.2, TCF7, SKP1, AC104109.3, PPP2CA, AC104109.2, CDKL3, UBE2B, AC109454.2, CDKN2AIPNL, AC109454.3, AC005355.1, LINC01843, JADE2, SAR1B, SEC24A, CAMLG, DDX46, C5orf24, TXNDC15, PCBD2, CATSPER3, PITX1, C5orf66, AC008406.3, C5orf66-AS2, H2AFY, AC026691.1, DCANP1, TIFAB, AC022092.1, NEUROG1, AC034206.1, CXCL14, SLC25A48, IL9, LECT2, TGFBI, SMAD5-AS1, SMAD5, AC063980.1, AC112178.1, SPOCK1, KLHL3, HNRNPA0, AC106791.2, AC106791.1, MYOT, PKD2L2, FAM13B, AC113382.1, AC113382.2, WNT8A, NME5, BRD8, KIF20A, CDC23, GFRA3, CDC25C, FAM53C, AC104116.1, KDM3B, REEP2, EGR1, ETF1, HSPA9, CTNNA1, AC034243.1, LRRTM2","VDAC1, SKP1, PPP2CA, UBE2B, CAMLG, DDX46, C5orf24, H2AFY, SMAD5, HNRNPA0, FAM13B, BRD8, KDM3B, ETF1, HSPA9, CTNNA1",71.0,16.0,,,,True,False,False,False,False,False,False,True,False,False,False,False,False,False,False,False,False,False,False,False,False,False,False,False,False,False,False,False,False,False,False,False,False,False,False,False,False,False,False,False,False,False,False,False,False,False,False,False,False,False,False,False,False,False,False,False,False,False,False,False,False,False,False,False,False,False,False,False,False,False,False,False,False,False,False,False,133968787.0,138875368.0,False
N212,all,N212_del_20q_middle,20,False,SRSF6,NFATC2,"SRSF6, L3MBTL1, Z98752.1, SGK2, Z98752.4, IFT52, MYBL2, GTSF1L, LINC01728, TOX2, JPH2, OSER1, OSER1-DT, GDAP1L1, FITM2, AL117382.1, HNF4A, HNF4A-AS1, LINC01620, TTPAL, SERINC3, PKIG, ADA, AL139352.1, LINC01260, KCNK15-AS1, WISP2, KCNK15, RIMS4, YWHAB, PABPC1L, TOMM34, STK4-AS1, STK4, KCNS1, PI3, SEMG1, SEMG2, SLPI, MATN4, RBPJL, SDC4, SYS1, SYS1-DBNDD2, TP53TG5, DBNDD2, PIGT, AL031663.3, WFDC2, WFDC8, WFDC10A, WFDC11, WFDC10B, WFDC13, SPINT4, WFDC3, DNTTIP1, UBE2C, TNNC2, SNX21, ACOT8, ZSWIM3, ZSWIM1, SPATA25, NEURL2, CTSA, AL008726.1, PLTP, PCIF1, ZNF335, MMP9, SLC12A5-AS1, SLC12A5, NCOA5, CD40, CDH22, SLC35C2, AL133227.1, ELMO2, ZNF334, OCSTAMP, SLC13A3, TP53RK, AL031055.1, SLC2A10, EYA2, AL354766.2, ZMYND8, AL031666.2, AL031666.1, LINC01754, NCOA3, SULF2, AL354813.1, AL139351.1, LINC00494, PREX1, AL133342.1, ARFGEF2, CSE1L-AS1, CSE1L, STAU1, DDX27, ZNFX1, ZFAS1, KCNB1, PTGIS, B4GALT5, SLC9A8, SPATA2, RNF114, SNAI1, TRERNA1, UBE2V1, TMEM189-UBE2V1, TMEM189, AL161937.2, AL161937.1, LINC01273, CEBPB-AS1, CEBPB, SMIM25, LINC01270, LINC01271, PTPN1, AL133230.1, RIPOR3, AL353653.1, PARD6B, BCAS4, ADNP, ADNP-AS1, DPM1, MOCS3, KCNG1, NFATC2","SRSF6, SERINC3, PKIG, YWHAB, STK4, ZMYND8, NCOA3, STAU1, DDX27, ZFAS1, PTPN1, ADNP",136.0,12.0,,,,True,False,False,False,False,False,False,False,False,False,False,False,False,False,False,True,False,False,False,False,False,False,False,False,False,False,False,False,False,False,False,False,False,False,False,False,False,False,False,False,False,False,False,False,False,False,False,False,False,False,False,False,False,False,False,False,False,False,False,False,False,False,False,False,False,False,False,False,False,False,False,False,False,False,False,False,43464247.0,51562831.0,False
N227,,,,,,,,,,,,,"clinical data says (among others) ""t(1q;21p)"". we dont see the t(21p). assuming the t(21p) is real, i guess we miss it because of the low number of genes there",,,False,False,False,False,False,False,False,False,False,False,False,False,False,False,False,False,False,False,False,False,False,False,False,False,False,False,False,False,False,False,False,False,False,False,False,False,False,False,False,False,False,False,False,False,False,False,False,False,False,False,False,False,False,False,False,False,False,False,False,False,False,False,False,False,False,False,False,False,False,False,False,False,False,False,,,False
