donor_id,exp_name,name,chrom,whole_chrom,first_gene,last_gene,genes,filtered_genes,num_of_genes,num_of_filtered_genes,manual_comment,manual_comment_for_blood_aging_paper,donor_general_manual_comment,is_del,is_dup,is_del_11p,is_del_11q,is_dup_11p,is_dup_11q,is_del_5p,is_del_5q,is_dup_5p,is_dup_5q,is_del_12p,is_del_12q,is_dup_12p,is_dup_12q,is_del_20p,is_del_20q,is_dup_20p,is_dup_20q,is_del_7p,is_del_7q,is_dup_7p,is_dup_7q,is_del_17p,is_del_17q,is_dup_17p,is_dup_17q,is_del_3p,is_del_3q,is_dup_3p,is_dup_3q,is_del_1,is_dup_1,is_del_2,is_dup_2,is_del_3,is_dup_3,is_del_4,is_dup_4,is_del_5,is_dup_5,is_del_6,is_dup_6,is_del_7,is_dup_7,is_del_8,is_dup_8,is_del_9,is_dup_9,is_del_10,is_dup_10,is_del_11,is_dup_11,is_del_12,is_dup_12,is_del_13,is_dup_13,is_del_14,is_dup_14,is_del_15,is_dup_15,is_del_16,is_dup_16,is_del_17,is_dup_17,is_del_18,is_dup_18,is_del_19,is_dup_19,is_del_20,is_dup_20,is_del_21,is_dup_21,is_del_22,is_dup_22,is_del_X,is_dup_X,first_gene_end_pos_in_chrom,last_gene_end_pos_in_chrom,contains_CSNK1A1
G8,all,G8_del_20q_middle,20,False,RALY,KCNB1,"RALY, EIF2S2, ASIP, AHCY, ITCH, ITCH-AS1, DYNLRB1, MAP1LC3A, PIGU, NCOA6, TP53INP2, GGT7, ACSS2, GSS, MYH7B, TRPC4AP, EDEM2, PROCR, AL356652.1, MMP24OS, MMP24, AL121753.1, EIF6, FAM83C-AS1, FAM83C, UQCC1, GDF5OS, GDF5, CEP250, FO393401.1, C20orf173, ERGIC3, SPAG4, CPNE1, RBM12, NFS1, ROMO1, RBM39, PHF20, SCAND1, CNBD2, NORAD, AL035420.3, AL035420.1, AL035420.2, EPB41L1, AL121895.1, AL121895.2, AAR2, DLGAP4, DLGAP4-AS1, MYL9, TGIF2, TGIF2-RAB5IF, RAB5IF, SLA2, NDRG3, DSN1, SOGA1, TLDC2, SAMHD1, RBL1, AL136172.1, MROH8, RPN2, GHRH, MANBAL, SRC, BLCAP, NNAT, AL162293.1, CTNNBL1, VSTM2L, TTI1, RPRD1B, AL031651.1, TGM2, KIAA1755, AL359555.4, AL359555.2, AL359555.1, BPI, LBP, AL391095.1, AL391095.3, RALGAPB, ADIG, ARHGAP40, SLC32A1, ACTR5, PPP1R16B, FAM83D, AL023803.2, AL023803.1, DHX35, LINC01734, AL118523.1, AL133419.1, MAFB, AL035665.1, TOP1, PLCG1-AS1, PLCG1, ZHX3, LPIN3, EMILIN3, CHD6, PTPRT, AL031676.1, SRSF6, L3MBTL1, Z98752.1, SGK2, Z98752.4, IFT52, MYBL2, GTSF1L, LINC01728, TOX2, JPH2, OSER1, OSER1-DT, GDAP1L1, FITM2, AL117382.1, HNF4A, HNF4A-AS1, LINC01620, TTPAL, SERINC3, PKIG, ADA, AL139352.1, LINC01260, KCNK15-AS1, WISP2, KCNK15, RIMS4, YWHAB, PABPC1L, TOMM34, STK4-AS1, STK4, KCNS1, PI3, SEMG1, SEMG2, SLPI, MATN4, RBPJL, SDC4, SYS1, SYS1-DBNDD2, TP53TG5, DBNDD2, PIGT, AL031663.3, WFDC2, WFDC8, WFDC10A, WFDC11, WFDC10B, WFDC13, SPINT4, WFDC3, DNTTIP1, UBE2C, TNNC2, SNX21, ACOT8, ZSWIM3, ZSWIM1, SPATA25, NEURL2, CTSA, AL008726.1, PLTP, PCIF1, ZNF335, MMP9, SLC12A5-AS1, SLC12A5, NCOA5, CD40, CDH22, SLC35C2, AL133227.1, ELMO2, ZNF334, OCSTAMP, SLC13A3, TP53RK, AL031055.1, SLC2A10, EYA2, AL354766.2, ZMYND8, AL031666.2, AL031666.1, LINC01754, NCOA3, SULF2, AL354813.1, AL139351.1, LINC00494, PREX1, AL133342.1, ARFGEF2, CSE1L-AS1, CSE1L, STAU1, DDX27, ZNFX1, ZFAS1, KCNB1","RALY, EIF2S2, DYNLRB1, MMP24OS, EIF6, ERGIC3, CPNE1, ROMO1, RBM39, PHF20, NORAD, RAB5IF, RPN2, CTNNBL1, TOP1, CHD6, SRSF6, SERINC3, PKIG, YWHAB, STK4, ZMYND8, NCOA3, STAU1, DDX27, ZFAS1",215.0,26.0,,,,True,False,False,False,False,False,False,False,False,False,False,False,False,False,False,True,False,False,False,False,False,False,False,False,False,False,False,False,False,False,False,False,False,False,False,False,False,False,False,False,False,False,False,False,False,False,False,False,False,False,False,False,False,False,False,False,False,False,False,False,False,False,False,False,False,False,False,False,False,False,False,False,False,False,False,False,34108308.0,49484297.0,False
N186,all,N186_del_5q_middle,5,False,SMAD5,HARS,"SMAD5, AC063980.1, AC112178.1, SPOCK1, KLHL3, HNRNPA0, AC106791.2, AC106791.1, MYOT, PKD2L2, FAM13B, AC113382.1, AC113382.2, WNT8A, NME5, BRD8, KIF20A, CDC23, GFRA3, CDC25C, FAM53C, AC104116.1, KDM3B, REEP2, EGR1, ETF1, HSPA9, CTNNA1, AC034243.1, LRRTM2, SIL1, AC011405.1, MATR3, SNHG4, MATR3---1, PAIP2, AC135457.1, SLC23A1, MZB1, PROB1, SPATA24, DNAJC18, ECSCR, SMIM33, TMEM173, UBE2D2, AC113361.1, CXXC5, CXXC5-AS1, AC008667.1, AC008667.3, AC008667.4, PSD2, NRG2, AC008667.2, MALINC1, PURA, IGIP, CYSTM1, PFDN1, HBEGF, AC008438.2, SLC4A9, AC008438.1, ANKHD1, ANKHD1-EIF4EBP3, SRA1, EIF4EBP3, APBB3, SLC35A4, CD14, NDUFA2, TMCO6, IK, DND1, HARS","SMAD5, HNRNPA0, FAM13B, BRD8, KDM3B, ETF1, HSPA9, CTNNA1, SIL1, PAIP2, MZB1, TMEM173, UBE2D2, CXXC5, PURA, PFDN1, NDUFA2, IK",76.0,18.0,,,,True,False,False,False,False,False,False,True,False,False,False,False,False,False,False,False,False,False,False,False,False,False,False,False,False,False,False,False,False,False,False,False,False,False,False,False,False,False,False,False,False,False,False,False,False,False,False,False,False,False,False,False,False,False,False,False,False,False,False,False,False,False,False,False,False,False,False,False,False,False,False,False,False,False,False,False,136188747.0,140691862.0,False
N186,all,N186_dup_dup_9p,9,False,WASHC1,DCAF10,"WASHC1, AL928970.1, FAM138C, PGM5P3-AS1, LINC01388, FOXD4, CBWD1, C9orf66, DOCK8, AL158832.1, AL161725.1, KANK1, AL136979.1, DMRT1, LINC01230, DMRT2, SMARCA2, AL359076.1, VLDLR-AS1, VLDLR, KCNV2, PUM3, LINC01231, RFX3, RFX3-AS1, AL354977.2, AL354977.1, GLIS3, GLIS3-AS1, SLC1A1, SPATA6L, PLPP6, CDC37L1-DT, CDC37L1, AK3, RCL1, JAK2, IGHEP2, INSL6, INSL4, RLN2, RLN1, AL135786.2, PLGRKT, CD274, PDCD1LG2, AL162253.1, RIC1, AL136980.1, ERMP1, KIAA2026, MLANA, RANBP6, AL162384.1, IL33, UHRF2, AL133480.1, GLDC, AL162411.1, AL354707.2, AL354707.1, KDM4C, AL354694.1, DMAC1, AL135923.2, PTPRD, PTPRD-AS1, AL596451.1, PTPRD-AS2, AL162413.1, AL589678.1, TYRP1, LURAP1L-AS1, LURAP1L, MPDZ, LINC01235, AL583785.1, NFIB, AL136366.1, AL159169.3, AL159169.2, ZDHHC21, CER1, FREM1, AL512643.1, TTC39B, SNAPC3, PSIP1, CCDC171, C9orf92, BNC2, AL449983.1, BNC2-AS1, CNTLN, SH3GL2, ADAMTSL1, SAXO1, RRAGA, HAUS6, PLIN2, DENND4C, AL161909.2, AL391834.1, AL391834.2, RPS6, ACER2, SLC24A2, AL591222.1, MLLT3, FOCAD, FOCAD-AS1, HACD4, IFNB1, IFNW1, IFNA21, IFNA5, KLHL9, IFNA13, IFNE, MTAP, AL359922.1, AL359922.2, CDKN2A-DT, CDKN2A, CDKN2B-AS1, CDKN2B, DMRTA1, LINC01239, AL391117.1, AC017067.1, AL445623.2, ELAVL2, AL365204.1, AL365204.2, TUSC1, CAAP1, PLAA, IFT74, IFT74-AS1, LRRC19, AL355432.1, TEK, EQTN, MOB3B, AL163192.1, IFNK, C9orf72, AL360014.1, LINGO2, LINC01242, ACO1, DDX58, TOPORS, SMIM27, NDUFB6, TAF1L, AL589642.1, AL589642.2, TMEM215, AL157884.2, APTX, DNAJA1, SMU1, B4GALT1, B4GALT1-AS1, SPINK4, BAG1, CHMP5, NFX1, AQP7, AQP3, NOL6, AL139008.2, ANKRD18B, CYP4F26P, TRBV20OR9-2, TRBV21OR9-2, TRBV23OR9-2, TRBV25OR9-2, AL356489.3, TRBV26OR9-2, AL356489.2, AL356489.1, LINC01251, PRSS3, UBE2R2-AS1, TRBV29OR9-2, UBE2R2, UBAP2, AL354989.1, DCAF12, UBAP1, KIF24, NUDT2, MYORG, C9orf24, FAM219A, DNAI1, ENHO, CNTFR, RPP25L, DCTN3, ARID3C, SIGMAR1, GALT, IL11RA, CCL27, AL162231.1, AL162231.2, CCL19, CCL21, PHF24, DNAJB5-DT, DNAJB5, C9orf131, VCP, FANCG, PIGO, AL353795.2, STOML2, FAM214B, UNC13B, RUSC2, FAM166B, TESK1, CD72, AL357874.2, AL357874.1, SIT1, RMRP, CCDC107, ARHGEF39, CA9, TPM2, TLN1, CREB3, GBA2, RGP1, MSMP, AL133410.2, AL133410.1, NPR2, SPAG8, HINT2, TMEM8B, FAM221B, HRCT1, SPAAR, RECK, GLIPR2, CCIN, CLTA, GNE, RNF38, MELK, PAX5, AL450267.1, AL161781.2, LINC01400, AL512604.3, EBLN3P, AL512604.2, ZCCHC7, GRHPR, ZBTB5, POLR1E, AL513165.1, FBXO10, AL513165.2, TOMM5, AL138752.2, FRMPD1, TRMT10B, EXOSC3, DCAF10","CBWD1, DOCK8, SMARCA2, PUM3, RFX3, AK3, KIAA2026, UHRF2, DMAC1, ZDHHC21, PSIP1, CCDC171, CNTLN, RPS6, MLLT3, HACD4, KLHL9, CAAP1, IFT74, TOPORS, SMIM27, NDUFB6, DNAJA1, SMU1, BAG1, CHMP5, NFX1, UBE2R2, UBAP2, DCTN3, VCP, STOML2, TLN1, HINT2, CLTA, EBLN3P, ZCCHC7, GRHPR",275.0,38.0,,,,False,True,False,False,False,False,False,False,False,False,False,False,False,False,False,False,False,False,False,False,False,False,False,False,False,False,False,False,False,False,False,False,False,False,False,False,False,False,False,False,False,False,False,False,False,False,False,False,False,False,False,False,False,False,False,False,False,False,False,False,False,False,False,False,False,False,False,False,False,False,False,False,False,False,False,False,73865.0,37867666.0,False
N186,all,N186_dup_9q,9,False,PIP5K1B,AL954642.1,"PIP5K1B, FAM122A, AL354794.1, PRKACG, FXN, AL358113.1, TJP2, BANCR, FAM189A2, APBA1, AL353693.1, AL162412.1, PTAR1, C9orf135-DT, C9orf135, MAMDC2-AS1, MAMDC2, SMC5-AS1, SMC5, KLF9, TRPM3, CEMIP2, ABHD17B, C9orf85, C9orf57, GDA, AL135924.2, LINC01504, ZFAND5, TMC1, LINC01474, ALDH1A1, ANXA1, AL451127.1, RORB-AS1, RORB, TRPM6, C9orf40, C9orf41-AS1, CARNMT1, NMRK1, OSTF1, PCSK5, RFK, GCNT1, PRUNE2, PCA3, VPS13A-AS1, VPS13A, GNA14, GNAQ, CEP78, PSAT1, AL358975.1, TLE4, AL161912.2, AL161782.1, LINC01507, AL138749.1, TLE1, AL591368.1, AL158154.2, SPATA31D1, AL162726.1, AL162726.4, RASEF, AL137847.1, FRMD3, AL137847.2, IDNK, UBQLN1, AL354920.1, GKAP1, AL354733.1, AL354733.2, KIF27, C9orf64, HNRNPK, AL354733.3, RMI1, AL390838.1, SLC28A3, AL356134.1, NTRK2, AGTPBP1, AL157882.1, AL353743.2, NAA35, GOLM1, C9orf153, ISCA1, TUT7, AL158828.1, AL353613.1, GAS1, GAS1RR, AL513318.2, C9orf170, DAPK1, CTSL, AL772337.2, AL772337.1, CDK20, SPIN1, NXNL2, C9orf47, S1PR3, SHC3, CKS2, SECISBP2, SEMA4D, GADD45G, AL606807.1, BX470209.1, AL161629.1, DIRAS2, SYK, AL355607.1, AL355607.2, AL158071.3, AL158071.1, AL158071.4, LINC00484, AL158071.5, AUH, NFIL3, AL353764.1, ROR2, SPTLC1, AL136097.2, IARS, NOL8, CENPP, OGN, OMD, ASPN, ECM2, IPPK, BICD2, ZNF484, FGD3, SUSD3, AL451065.1, CARD19, NINJ1, AL390760.1, WNK2, C9orf129, AL583839.2, AL583839.1, FAM120AOS, FAM120A, PHF2, PTPDC1, AL158152.2, AL158152.1, MIRLET7DHG, ZNF169, AL691447.2, MFSD14B, PCAT7, FBP2, FBP1, C9orf3, AL353768.1, FANCC, AL354893.2, AL161729.3, PTCH1, AL161729.2, AL161729.1, AL161729.4, LINC00476, AL354861.3, ERCC6L2, LINC00092, AL449403.1, AL449403.2, HSD17B3, AL160269.1, HSD17B3-AS1, SLC35D2, ZNF367, HABP4, CDC14B, AAED1, AL589843.1, ZNF510, ZNF782, MFSD14C, NUTM2G, CTSV, AL590705.3, AL590705.1, CCDC180, TDRD7, TMOD1, AL162385.1, TSTD2, NCBP1, AL162385.2, XPA, AL445531.1, FOXE1, TRMO, HEMGN, ANP32B, AL354726.1, NANS, TRIM14, CORO2A, TBC1D2, GABBR2, ANKS6, GALNT12, AL136084.2, COL15A1, AL136084.3, TGFBR1, ALG2, SEC61B, AL137067.1, AL162394.1, AL359710.1, NR4A3, STX17-AS1, STX17, AL358937.1, ERP44, INVS, TEX10, MSANTD3, MSANTD3-TMEFF1, TMEFF1, CAVIN4, BAAT, MRPL50, ZNF189, ALDOB, TMEM246-AS1, TMEM246, RNF20, GRIN3A, PPP3R2, CYLC2, LINC01492, AL590381.1, SMC2-AS1, SMC2, OR13F1, AL450426.1, OR13C4, OR13C3, OR13C8, OR13C5, OR13C2, OR13C9, OR13D1, NIPSNAP3A, NIPSNAP3B, ABCA1, AL359182.1, AL359182.2, SLC44A1, FSD1L, AL158070.1, FKTN, TAL2, TMEM38B, LINC01505, AL732323.1, ZNF462, AL807761.4, AL807761.3, RAD23B, LINC01509, KLF4, AL353742.1, AL358779.1, ACTL7B, ACTL7A, ELP1, FAM206A, CTNNAL1, TMEM245, FRRS1L, EPB41L4B, PTPN3, PALM2, AKAP2, C9orf152, TXN, TXNDC8, SVEP1, AL592463.1, MUSK, LPAR1, AL162414.1, OR2K2, ECPAS, ZNF483, PTGR1, AL135787.1, DNAJC25, DNAJC25-GNG10, GNG10, C9orf84, UGCG, SUSD1, PTBP3, HSDL2, C9orf147, KIAA1958, INIP, AL390067.1, SNX30, SLC46A2, AL139041.1, ZNF883, ZFP37, FAM225B, FAM225A, SLC31A2, FKBP15, SLC31A1, CDC26, PRPF4, RNF183, WDR31, BSPRY, HDHD3, ALAD, POLE3, C9orf43, RGS3, AL162727.2, AL162727.1, AL157702.2, ZNF618, AMBP, KIF12, COL27A1, ORM1, ORM2, AKNA, AL138895.1, WHRN, ATP6V1G1, TMEM268, TEX53, TEX48, TNFSF15, TNFSF8, TNC, AL162425.1, DEC1, PAPPA, PAPPA-AS2, AL137024.1, PAPPA-AS1, ASTN2, AL133284.1, TRIM32, AL161630.1, AL160272.2, TLR4, AL160272.1, AL354754.1, BRINP1, CDK5RAP2, MEGF9, FBXW2, B3GNT10, PSMD5, PHF19, TRAF1, C5, CNTRL, RAB14, GSN, AL513122.2, GSN-AS1, STOM, AL359644.1, DAB2IP, AL357936.1, TTLL11, TTLL11-IT1, NDUFA8, MORN5, LHX6, RBM18, MRRF, PTGS1, AL359636.3, AL359636.1, AL359636.2, OR1J1, OR1J2, OR1J4, OR1N1, OR1N2, OR1L8, AL162254.1, OR1Q1, OR1B1, OR1L1, OR1L3, OR1L4, OR1L6, OR5C1, PDCL, OR1K1, RC3H2, ZBTB6, ZBTB26, RABGAP1, GPR21, STRBP, CRB2, DENND1A, AL445489.1, AL390774.2, LHX2, NEK6, AL162724.2, PSMB7, ADGRD2, NR5A1, AL354979.1, NR6A1, MIR181A2HG, AL354928.1, OLFML2A, WDR38, RPL35, ARPC5L, GOLGA1, SCAI, PPP6C, RABEPK, HSPA5, AL354710.2, GAPVD1, MAPKAP1, AL162584.1, PBX3, MVB12B, AL356309.2, AL356309.1, LMX1B, ZBTB43, ZBTB34, RALGPS1, ANGPTL2, AL450263.1, GARNL3, SLC2A8, ZNF79, RPL12, LRSAM1, FAM129B, STXBP1, AL162426.1, PTRH1, CFAP157, TTC16, TOR2A, SH2D3C, CDK9, FPGS, ENG, AL162586.1, AK1, AL157935.2, ST6GALNAC6, ST6GALNAC4, PIP5KL1, AL157935.1, DPM2, FAM102A, AL360268.2, NAIF1, SLC25A25, AL360268.1, SLC25A25-AS1, PTGES2, AL590708.1, LCN2, C9orf16, CIZ1, DNM1, GOLGA2, SWI5, TRUB2, AL359091.4, COQ4, SLC27A4, URM1, AL359091.1, CERCAM, ODF2, ODF2-AS1, GLE1, AL356481.1, SPTAN1, AL356481.3, WDR34, HMGA1P4, SET, PKN3, ZDHHC12, AL441992.1, ZER1, TBC1D13, ENDOG, SPOUT1, KYAT1, LRRC8A, PHYHD1, DOLK, NUP188, AL592211.1, SH3GLB2, MIGA2, DOLPP1, CRAT, AL158151.2, PTPA, AL158151.4, IER5L, AL158151.3, AL158151.1, AL161785.2, AL161785.3, AL161785.1, C9orf106, AL353803.5, LINC01503, AL353803.2, AL353803.1, AL353803.4, AL391056.1, NTMT1, C9orf50, ASB6, AL590369.1, PRRX2, PTGES, TOR1B, TOR1A, C9orf78, USP20, FNBP1, AL158207.2, AL136141.1, GPR107, AL360004.1, NCS1, HMCN2, ASS1, FUBP3, PRDM12, EXOSC2, ABL1, QRFP, FIBCD1, AL161733.1, LAMC3, AIF1L, NUP214, AL157938.2, AL157938.3, FAM78A, PLPP7, PRRC2B, AL358781.1, POMT1, AL358781.2, UCK1, PRRT1B, RAPGEF1, MED27, NTNG2, SETX, TTF1, CFAP77, BARHL1, DDX31, GTF3C4, AK8, SPACA9, TSC1, GFI1B, GTF3C5, CEL, RALGDS, AL162417.1, GBGT1, OBP2B, ABO, SURF6, MED22, RPL7A, SURF1, SURF2, SURF4, STKLD1, REXO4, ADAMTS13, CACFD1, SLC2A6, ADAMTSL2, DBH, DBH-AS1, SARDH, VAV2, BRD3OS, BRD3, AL445931.1, BX649632.1, WDR5, BX649601.1, LINC02247, RXRA, AL669970.1, AL669970.3, AL669970.2, COL5A1, COL5A1-AS1, FCN2, FCN1, AL353611.1, OLFM1, C9orf62, PPP1R26-AS1, PPP1R26, C9orf116, MRPS2, AL161452.1, LCN1, PAEP, LINC01502, AL354761.1, SOHLH1, KCNT1, CAMSAP1, AL355574.1, UBAC1, NACC2, AL138781.1, TMEM250, AL138781.2, LHX3, QSOX2, CCDC187, CR392000.2, AC174065.1, GPSM1, DNLZ, CARD9, SNAPC4, ENTR1, PMPCA, INPP5E, SEC16A, C9orf163, NOTCH1, AL592301.1, NALT1, AL590226.2, AL590226.1, EGFL7, AGPAT2, FAM69B, SNHG7, LCN10, LCN6, LCN8, LCN15, TMEM141, AL355987.3, CCDC183, CCDC183-AS1, RABL6, AJM1, PHPT1, MAMDC4, EDF1, TRAF2, FBXW5, C8G, LCN12, PTGDS, LCNL1, PAXX, CLIC3, ABCA2, C9orf139, FUT7, AL807752.6, NPDC1, ENTPD2, AL807752.4, AL807752.2, SAPCD2, AL807752.3, UAP1L1, MAN1B1-DT, MAN1B1, DPP7, GRIN1, LRRC26, TMEM210, ANAPC2, SSNA1, TPRN, TMEM203, NDOR1, BX255925.3, RNF208, CYSRT1, RNF224, SLC34A3, TUBB4B, FAM166A, STPG3-AS1, STPG3, NELFB, TOR4A, NRARP, EXD3, NOXA1, ENTPD8, NSMF, PNPLA7, MRPL41, DPH7, ZMYND19, ARRDC1, ARRDC1-AS1, EHMT1, AL772363.1, CACNA1B, AL954642.1","PTAR1, SMC5, ZFAND5, ALDH1A1, ANXA1, RFK, VPS13A, GNAQ, TLE4, UBQLN1, HNRNPK, TUT7, DAPK1, SPIN1, CKS2, SECISBP2, SYK, IARS, NOL8, BICD2, CARD19, FAM120AOS, FAM120A, MFSD14C, XPA, HEMGN, ANP32B, STX17, ERP44, MRPL50, RNF20, SMC2, NIPSNAP3A, RAD23B, TXN, PTBP3, CDC26, POLE3, CNTRL, RAB14, STOM, NDUFA8, PDCL, RC3H2, RABGAP1, STRBP, PSMB7, RPL35, ARPC5L, SCAI, HSPA5, GAPVD1, MAPKAP1, RPL12, GOLGA2, SPTAN1, SET, C9orf78, FNBP1, NUP214, PRRC2B, SETX, TTF1, SURF6, RPL7A, SURF1, REXO4, BRD3, UBAC1, FAM69B, SNHG7, TMEM141, RABL6, PHPT1, NPDC1, DPP7, SSNA1, TUBB4B, MRPL41, EHMT1",745.0,80.0,,,,False,True,False,False,False,False,False,False,False,False,False,False,False,False,False,False,False,False,False,False,False,False,False,False,False,False,False,False,False,False,False,False,False,False,False,False,False,False,False,False,False,False,False,False,False,False,False,False,False,False,False,False,False,False,False,False,False,False,False,False,False,False,False,False,False,False,False,False,False,False,False,False,False,False,False,False,69009176.0,138203325.0,False
N186,all,N186_dup_10,10,True,TUBB8,FRG2B,,"ZMYND11, GTPBP4, IDI1, KLF6, AKR1C3, FAM208B, GDI2, RBM17, KIN, ATP5F1C, CELF2, UPF2, NUDT5, CDC123, CAMK1D, DCLRE1C, RPP38, RSU1, ST8SIA6, HACD1, STAM, NSUN6, AL157895.1, PLXDC2, MLLT10, DNAJC1, COMMD3, BMI1, PIP4K2A, MSRB2, APBB1IP, ABI1, YME1L1, RAB18, WAC-AS1, WAC, KIF5B, EPC1, ITGB1, CCNY, ZNF33A, ZNF37A, ZNF33B, BMS1, HNRNPF, ZNF22, NCOA4, ARHGAP22, TFAM, CCDC6, ARID5B, NRBF2, JMJD1C, HERC4, HNRNPH3, CCAR1, DDX50, DDX21, SRGN, VPS26A, PPA1, EIF4EBP2, PCBD1, PSAP, ANAPC16, MICU1, DNAJC9, MRPS16, ANXA7, CHCHD1, VCL, ADK, KAT6B, VDAC2, RPS24, ZMIZ1, NUTM2B-AS1, ANXA11, GHITM, WAPL, GLUD1, ATAD1, PTEN, RPP30, TNKS2, HHEX, EXOC6, FRA10AC1, NOC3L, HELLS, PDLIM1, ZNF518A, TM9SF3, LCOR, PGAM1, EXOSC1, HPS1, BLOC1S2, NDUFB8, SLF2, MRPL43, OGA, NOLC1, CUEDC2, TRIM8, BORCS7, NT5C2, ATP5MD, PDCD11, SLK, GSTO1, ADD3, SMNDC1, SMC3, PDCD4, SHOC2, CCDC186, ABLIM1, PDZD8, FAM204A, CACUL1, EIF3A, PRDX3, RGS10, TIAL1, WDR11, ATE1, BUB3, CTBP2, UROS, BCCIP, MGMT, GLRX3, TUBGCP2, ECHS1",1097.0,135.0,,,,False,True,False,False,False,False,False,False,False,False,False,False,False,False,False,False,False,False,False,False,False,False,False,False,False,False,False,False,False,False,False,False,False,False,False,False,False,False,False,False,False,False,False,False,False,False,False,False,False,True,False,False,False,False,False,False,False,False,False,False,False,False,False,False,False,False,False,False,False,False,False,False,False,False,False,False,74163.0,133626795.0,False
N186,all,N186_del_17p_start,17,False,AC240565.2,STX8,"AC240565.2, AC240565.1, SCGB1C2, DOC2B, LINC02091, RPH3AL, AC129507.4, AC129507.2, AC129507.3, AC141424.1, C17orf97, RFLNB, AC015853.2, VPS53, AC015853.3, AC015853.1, FAM57A, GEMIN4, GLOD4, AC087392.3, MRM3, AC087392.4, AC087392.5, NXN, AC087392.2, AC087392.1, TIMM22, ABR, AC144836.1, TRARG1, YWHAE, CRK, AC032044.1, MYO1C, INPP5K, PITPNA-AS1, PITPNA, SLC43A2, SCARF1, RILP, PRPF8, AC130343.2, TLCD2, MIR22HG, WDR81, AC130343.1, SERPINF2, SERPINF1, SMYD4, RPA1, RTN4RL1, AC099684.2, AC099684.1, DPH1, OVCA2, AC090617.3, AC090617.5, HIC1, SMG6, AC090617.4, AC090617.2, AL450226.1, SRR, TSR1, SGSM2, AC006435.3, AC006435.2, MNT, AC006435.1, METTL16, PAFAH1B1, AC005696.2, AC005696.3, CLUH, AC005696.1, AC005696.4, RAP1GAP2, AC015921.1, OR1D5, OR1D2, OR1G1, AC090282.1, OR1A1, OR3A2, OR3A1, AC087498.1, OR1E1, OR3A3, OR1E2, SPATA22, ASPA, TRPV3, TRPV1, AC027796.3, SHPK, CTNS, AC027796.4, TAX1BP3, P2RX5-TAX1BP3, EMC6, P2RX5, ITGAE, AC116914.2, HASPIN, AC116914.1, NCBP3, CAMKK1, P2RX1, ATP2A3, LINC01975, ZZEF1, CYB5D2, ANKFY1, AC087292.1, AC087742.1, UBE2G1, SPNS3, AC127521.1, AC118754.1, SPNS2, MYBBP1A, GGT6, AC118754.2, SMTNL2, LINC01996, ALOX15, PELP1, AC091153.2, AC091153.3, ARRB2, MED11, AC091153.4, CXCL16, ZMYND15, TM4SF5, VMO1, GLTPD2, PSMB6, AC233723.1, PLD2, MINK1, CHRNE, C17orf107, GP1BA, SLC25A11, RNF167, PFN1, ENO3, SPAG7, CAMTA2, AC004771.4, AC004771.2, AC004771.5, AC004771.3, INCA1, KIF1C, AC004771.1, SLC52A1, AC012146.3, ZFP3, ZNF232, USP6, ZNF594, AC087500.1, SCIMP, AC087500.2, RABEP1, NUP88, AC015727.1, RPAIN, AC004148.2, C1QBP, DHX33, AC004148.1, DERL2, MIS12, NLRP1, AC007846.1, WSCD1, AIPL1, PIMREG, PITPNM3, KIAA0753, TXNDC17, MED31, C17orf100, AC004706.1, SLC13A5, XAF1, FBXO39, TEKT1, ALOX12-AS1, AC027763.2, AC040977.1, ALOX12, RNASEK, RNASEK-C17orf49, C17orf49, MIR497HG, BCL6B, SLC16A13, SLC16A11, CLEC10A, ASGR2, ASGR1, DLG4, ACADVL, DVL2, PHF23, GABARAP, CTDNEP1, AC003688.1, ELP5, CLDN7, SLC2A4, YBX2, EIF5A, GPS2, AC026954.2, NEURL4, ACAP1, KCTD11, AC026954.3, TMEM95, TNK1, PLSCR3, TMEM256-PLSCR3, TMEM256, NLGN2, SPEM1, SPEM2, SPEM3, TMEM102, FGF11, CHRNB1, ZBTB4, SLC35G6, POLR2A, TNFSF12, TNFSF12-TNFSF13, AC016876.3, TNFSF13, SENP3, SENP3-EIF4A1, EIF4A1, CD68, AC016876.1, MPDU1, SOX15, FXR2, SHBG, SAT2, ATP1B2, TP53, WRAP53, EFNB3, DNAH2, KDM6B, TMEM88, NAA38, CYB5D1, CHD3, RNF227, KCNAB3, AC104581.2, TRAPPC1, CNTROB, GUCY2D, ALOX15B, AC129492.2, ALOX12B, AC129492.1, ALOXE3, HES7, PER1, VAMP2, TMEM107, AC129492.4, BORCS6, AURKB, LINC00324, CTC1, PFAS, AC135178.5, SLC25A35, RANGRF, ARHGEF15, AC135178.1, AC135178.4, ODF4, AC135178.3, KRBA2, AC135178.2, RPL26, RNF222, NDEL1, MYH10, CCDC42, SPDYE4, MFSD6L, PIK3R6, PIK3R5, AC002091.2, AC002091.1, NTN1, AC005695.1, AC005695.3, STX8","RFLNB, GLOD4, YWHAE, PRPF8, PAFAH1B1, EMC6, ITGAE, NCBP3, P2RX1, ATP2A3, PSMB6, PFN1, SPAG7, RABEP1, RPAIN, TXNDC17, XAF1, ACADVL, CTDNEP1, ACAP1, TMEM256, POLR2A, EIF4A1, SAT2, TP53, KDM6B, NAA38, CHD3, TRAPPC1, VAMP2, TMEM107, RPL26",308.0,32.0,,,,True,False,False,False,False,False,False,False,False,False,False,False,False,False,False,False,False,False,False,False,False,False,True,False,False,False,False,False,False,False,False,False,False,False,False,False,False,False,False,False,False,False,False,False,False,False,False,False,False,False,False,False,False,False,False,False,False,False,False,False,False,False,False,False,False,False,False,False,False,False,False,False,False,False,False,False,76866.0,9576591.0,False
N186,all,N186_dup_dup_18q_middle,18,False,C18orf21,SMAD2,"C18orf21, RPRD1A, SLC39A6, ELP2, AC023043.1, MOCOS, FHOD3, TPGS2, KIAA1328, AC016493.1, AC015961.1, CELF4, AC015961.2, AC100781.1, AC016205.1, AC011139.1, LINC01901, LINC01902, LINC01477, AC021504.1, PIK3C3, LINC00907, RIT2, SYT4, LINC01478, AC120049.1, SETBP1, SLC14A2, SLC14A2-AS1, AC023421.2, SLC14A1, SIGLEC15, EPG5, PSTPIP2, ATP5F1A, HAUS1, C18orf25, RNF165, LOXHD1, ST8SIA5, AC090241.3, PIAS2, KATNAL2, ELOA3D, ELOA3, ELOA2, AC012254.3, HDHD2, AC012254.2, IER3IP1, MIR4527HG, SMAD2","ELP2, TPGS2, AC011139.1, PIK3C3, PSTPIP2, ATP5F1A, HAUS1, PIAS2, IER3IP1, SMAD2",52.0,10.0,"the number of genes we consider is very small, so maybe it is form of regional transcriptional regulation?",,,False,True,False,False,False,False,False,False,False,False,False,False,False,False,False,False,False,False,False,False,False,False,False,False,False,False,False,False,False,False,False,False,False,False,False,False,False,False,False,False,False,False,False,False,False,False,False,False,False,False,False,False,False,False,False,False,False,False,False,False,False,False,False,False,False,False,False,False,False,False,False,False,False,False,False,False,35979286.0,47931146.0,False
N186,all,N186_del_20p_start,20,False,DEFB125,RALGAPA2,"DEFB125, DEFB126, DEFB129, DEFB132, AL034548.1, C20orf96, ZCCHC3, NRSN2-AS1, SOX12, NRSN2, TRIB3, RBCK1, TBC1D20, CSNK2A1, TCF15, SRXN1, SCRT2, SLC52A3, FAM110A, ANGPT4, RSPO4, PSMF1, AL031665.2, TMEM74B, C20orf202, RAD21L1, SNPH, SDCBP2, AL136531.2, SDCBP2-AS1, AL136531.1, FKBP1A, NSFL1C, SIRPB2, SIRPD, AL049634.2, SIRPB1, SIRPG, SIRPG-AS1, AL121760.1, AL117335.1, SIRPA, PDYN-AS1, STK35, AL121899.1, TGM3, SNRPB, AL049650.1, ZNF343, TMC2, NOP56, IDH3B, AL049712.1, EBF4, CPXM1, C20orf141, TMEM239, PCED1A, VPS16, PTPRA, GNRH2, MRPS26, OXT, AVP, UBOX5-AS1, UBOX5, FASTKD5, LZTS3, DDRGK1, ITPA, SLC4A11, AL109976.1, C20orf194, ATRN, ADAM33, SIGLEC1, HSPA12B, C20orf27, SPEF1, CENPB, CDC25B, LINC01730, AP5S1, MAVS, AL353194.1, PANK2, AL031670.1, RNF24, AL356414.1, SMOX, LINC01433, ADRA1D, PRNP, PRND, PRNT, AL133396.2, RASSF2, SLC23A2, AL121890.3, AL121890.2, AL121890.5, AL121890.4, TMEM230, PCNA, CDS2, AL121757.2, LINC00658, AL121757.1, LINC00654, AL109935.2, LINC01729, AL109935.1, GPCPD1, SHLD1, CHGB, TRMT6, MCM8, MCM8-AS1, AL035461.2, CRLS1, LRRN4, AL118505.1, FERMT1, BMP2, AL096799.1, LINC01428, LINC01751, LINC01706, TMX4, AL021396.1, PLCB1, PLCB4, LAMP5-AS1, LAMP5, PAK5, PARAL1, ANKEF1, SNAP25-AS1, AL354824.1, AL354824.2, SNAP25, MKKS, SLX4IP, JAG1, AL050403.2, LINC01752, AL158042.1, C20orf187, AL049649.1, AL161938.1, BTBD3, AL035448.1, LINC01722, AL078623.1, LINC01723, SPTLC3, ISM1, ISM1-AS1, AL050320.1, AL121782.1, TASP1, ESF1, NDUFAF5, SEL1L2, MACROD2, FLRT3, MACROD2-AS1, AL121584.1, KIF16B, AL049794.1, AL049794.2, SNRPB2, OTOR, PCSK2, BFSP1, DSTN, RRBP1, BANF2, AL035045.1, SNX5, OVOL2, MGME1, PET117, KAT14, ZNF133, AL049646.2, AL049646.1, LINC00851, DZANK1, POLR3F, RBBP9, SEC23B, SMIM26, AL121900.2, DTD1, AL121900.1, LINC00652, AL035563.1, SCP2D1, SLC24A3, AL136090.1, AL049647.1, AL121761.2, AL121761.1, AL132821.1, RIN2, NAA20, CRNKL1, CFAP61, INSM1, RALGAPA2","RBCK1, CSNK2A1, PSMF1, FKBP1A, NSFL1C, SNRPB, NOP56, IDH3B, CPXM1, PTPRA, MRPS26, DDRGK1, ITPA, MAVS, RNF24, TMEM230, GPCPD1, TMX4, PLCB1, ESF1, SNRPB2, DSTN, RRBP1, SNX5, MGME1, SMIM26, DTD1, NAA20, CRNKL1",211.0,29.0,,,,True,False,False,False,False,False,False,False,False,False,False,False,False,False,True,False,False,False,False,False,False,False,False,False,False,False,False,False,False,False,False,False,False,False,False,False,False,False,False,False,False,False,False,False,False,False,False,False,False,False,False,False,False,False,False,False,False,False,False,False,False,False,False,False,False,False,False,False,False,False,False,False,False,False,False,False,97094.0,20712488.0,False
