N191,demux_28_11_21_1,N191_dup_13_demux_28_11_21_1,13,True,LINC00408,LINC01054,,"MPHOSPH8, PSPC1, ZMYM5, ZMYM2, MRPL57, MICU2, PARP4, RPL21, GTF3A, MTIF3, POLR1D, FLT3, PAN3, POMP, UBL3, HMGB1, HSPH1, N4BP2L1, N4BP2L2, PDS5B, SPART, EXOSC8, SUPT20H, UFM1, NHLRC3, MRPS31, ELF1, WBP4, AKAP11, EPSTI1, DNAJC15, TSC22D1, GPALPP1, GTF2F2, TPT1, ZC3H13, LCP1, MED4, ITM2B, RB1, FNDC3A, SETDB2, PHF11, EBPL, KPNA3, TRIM13, RNASEH2B, INTS6, WDFY2, VPS36, CKAP2, SUGT1, PCDH9, DIS3, PIBF1, COMMD6, CLN5, FBXL3, MYCBP2, RNF219, RBM26, DNAJC3, IPO5, TM9SF2, TPP2, ARGLU1, TNFSF13B, ANKRD10, PCID2, LAMP1, CDC16, UPF3A",564.0,72.0,"observed in demux_28_11_21_1, but not in demux_n_04_12_23_1",,,False,True,False,False,False,False,False,False,False,False,False,False,False,False,False,False,False,False,False,False,False,False,False,False,False,False,False,False,False,False,False,False,False,False,False,False,False,False,False,False,False,False,False,False,False,False,False,False,False,False,False,False,False,False,False,True,False,False,False,False,False,False,False,False,False,False,False,False,False,False,False,False,False,False,False,False,18907810.0,114333948.0,False
N191,demux_28_11_21_1,N191_del_17p_start_demux_28_11_21_1,17,False,AC240565.2,ELAC2,"AC240565.2, AC240565.1, SCGB1C2, DOC2B, LINC02091, RPH3AL, AC129507.4, AC129507.2, AC129507.3, AC141424.1, C17orf97, RFLNB, AC015853.2, VPS53, AC015853.3, AC015853.1, FAM57A, GEMIN4, GLOD4, AC087392.3, MRM3, AC087392.4, AC087392.5, NXN, AC087392.2, AC087392.1, TIMM22, ABR, AC144836.1, TRARG1, YWHAE, CRK, AC032044.1, MYO1C, INPP5K, PITPNA-AS1, PITPNA, SLC43A2, SCARF1, RILP, PRPF8, AC130343.2, TLCD2, MIR22HG, WDR81, AC130343.1, SERPINF2, SERPINF1, SMYD4, RPA1, RTN4RL1, AC099684.2, AC099684.1, DPH1, OVCA2, AC090617.3, AC090617.5, HIC1, SMG6, AC090617.4, AC090617.2, AL450226.1, SRR, TSR1, SGSM2, AC006435.3, AC006435.2, MNT, AC006435.1, METTL16, PAFAH1B1, AC005696.2, AC005696.3, CLUH, AC005696.1, AC005696.4, RAP1GAP2, AC015921.1, OR1D5, OR1D2, OR1G1, AC090282.1, OR1A1, OR3A2, OR3A1, AC087498.1, OR1E1, OR3A3, OR1E2, SPATA22, ASPA, TRPV3, TRPV1, AC027796.3, SHPK, CTNS, AC027796.4, TAX1BP3, P2RX5-TAX1BP3, EMC6, P2RX5, ITGAE, AC116914.2, HASPIN, AC116914.1, NCBP3, CAMKK1, P2RX1, ATP2A3, LINC01975, ZZEF1, CYB5D2, ANKFY1, AC087292.1, AC087742.1, UBE2G1, SPNS3, AC127521.1, AC118754.1, SPNS2, MYBBP1A, GGT6, AC118754.2, SMTNL2, LINC01996, ALOX15, PELP1, AC091153.2, AC091153.3, ARRB2, MED11, AC091153.4, CXCL16, ZMYND15, TM4SF5, VMO1, GLTPD2, PSMB6, AC233723.1, PLD2, MINK1, CHRNE, C17orf107, GP1BA, SLC25A11, RNF167, PFN1, ENO3, SPAG7, CAMTA2, AC004771.4, AC004771.2, AC004771.5, AC004771.3, INCA1, KIF1C, AC004771.1, SLC52A1, AC012146.3, ZFP3, ZNF232, USP6, ZNF594, AC087500.1, SCIMP, AC087500.2, RABEP1, NUP88, AC015727.1, RPAIN, AC004148.2, C1QBP, DHX33, AC004148.1, DERL2, MIS12, NLRP1, AC007846.1, WSCD1, AIPL1, PIMREG, PITPNM3, KIAA0753, TXNDC17, MED31, C17orf100, AC004706.1, SLC13A5, XAF1, FBXO39, TEKT1, ALOX12-AS1, AC027763.2, AC040977.1, ALOX12, RNASEK, RNASEK-C17orf49, C17orf49, MIR497HG, BCL6B, SLC16A13, SLC16A11, CLEC10A, ASGR2, ASGR1, DLG4, ACADVL, DVL2, PHF23, GABARAP, CTDNEP1, AC003688.1, ELP5, CLDN7, SLC2A4, YBX2, EIF5A, GPS2, AC026954.2, NEURL4, ACAP1, KCTD11, AC026954.3, TMEM95, TNK1, PLSCR3, TMEM256-PLSCR3, TMEM256, NLGN2, SPEM1, SPEM2, SPEM3, TMEM102, FGF11, CHRNB1, ZBTB4, SLC35G6, POLR2A, TNFSF12, TNFSF12-TNFSF13, AC016876.3, TNFSF13, SENP3, SENP3-EIF4A1, EIF4A1, CD68, AC016876.1, MPDU1, SOX15, FXR2, SHBG, SAT2, ATP1B2, TP53, WRAP53, EFNB3, DNAH2, KDM6B, TMEM88, NAA38, CYB5D1, CHD3, RNF227, KCNAB3, AC104581.2, TRAPPC1, CNTROB, GUCY2D, ALOX15B, AC129492.2, ALOX12B, AC129492.1, ALOXE3, HES7, PER1, VAMP2, TMEM107, AC129492.4, BORCS6, AURKB, LINC00324, CTC1, PFAS, AC135178.5, SLC25A35, RANGRF, ARHGEF15, AC135178.1, AC135178.4, ODF4, AC135178.3, KRBA2, AC135178.2, RPL26, RNF222, NDEL1, MYH10, CCDC42, SPDYE4, MFSD6L, PIK3R6, PIK3R5, AC002091.2, AC002091.1, NTN1, AC005695.1, AC005695.3, STX8, AC005695.2, AC087501.1, AC087501.2, AC087501.3, CFAP52, AC118755.2, USP43, AC027045.3, GLP2R, RCVRN, GAS7, MYH13, AC005291.1, AC005323.2, MYHAS, MYH8, MYH4, MYH2, MYH3, AC002347.1, SCO1, AC002347.2, ADPRM, TMEM220, TMEM220-AS1, AC015908.3, AC015908.4, TMEM238L, PIRT, AC015908.2, SHISA6, AC005725.1, DNAH9, AC005410.2, ZNF18, MAP2K4, AC005244.2, LINC00670, MYOCD, AC005358.2, ARHGAP44, AC005277.2, AC005277.1, ELAC2","RFLNB, GLOD4, YWHAE, PRPF8, PAFAH1B1, EMC6, ITGAE, NCBP3, P2RX1, ATP2A3, PSMB6, PFN1, SPAG7, RABEP1, RPAIN, TXNDC17, XAF1, ACADVL, CTDNEP1, ACAP1, TMEM256, POLR2A, EIF4A1, SAT2, TP53, KDM6B, NAA38, CHD3, TRAPPC1, VAMP2, TMEM107, RPL26, SCO1",352.0,33.0,"observed in demux_28_11_21_1, but not in demux_n_04_12_23_1",,,True,False,False,False,False,False,False,False,False,False,False,False,False,False,False,False,False,False,False,False,False,False,True,False,False,False,False,False,False,False,False,False,False,False,False,False,False,False,False,False,False,False,False,False,False,False,False,False,False,False,False,False,False,False,False,False,False,False,False,False,False,False,False,False,False,False,False,False,False,False,False,False,False,False,False,False,76866.0,13018187.0,False
N191,demux_28_11_21_1,N191_del_21_demux_28_11_21_1,21,True,FP565260.3,PRMT2,,"NRIP1, C21orf91, LINC02573, APP, LTN1, USP16, CCT8, BACH1, SOD1, CFAP298, PAXBP1, IFNAR1, GART, SON, ATP5PO, MRPS6, SLC5A3, RUNX1, MORC3, PIGP, TTC3, DYRK1A, ERG, ETS2, PSMG1, BRWD1, HMGN1, NDUFV3, RRP1B, CSTB, TRAPPC10, UBE2G2, SUMO3, PTTG1IP, C21orf58, PCNT, DIP2A, PRMT2",395.0,38.0,"observed in demux_28_11_21_1, but not in demux_n_04_12_23_1",,,True,False,False,False,False,False,False,False,False,False,False,False,False,False,False,False,False,False,False,False,False,False,False,False,False,False,False,False,False,False,False,False,False,False,False,False,False,False,False,False,False,False,False,False,False,False,False,False,False,False,False,False,False,False,False,False,False,False,False,False,False,False,False,False,False,False,False,False,False,False,True,False,False,False,False,False,5040666.0,46665124.0,False
N191,demux_28_11_21_1,N191_del_xq_middle_demux_28_11_21_1,X,False,NAP1L3,TCEAL3-AS1,"NAP1L3, FAM133A, DIAPH2, RPA4, DIAPH2-AS1, PCDH19, TNMD, TSPAN6, SRPX2, SYTL4, CSTF2, NOX1, XKRX, ARL13A, TRMT2B, TMEM35A, CENPI, DRP2, TAF7L, TIMM8A, BTK, RPL36A, RPL36A-HNRNPH2, GLA, HNRNPH2, ARMCX4, ARMCX1, ARMCX6, ARMCX3, ARMCX3-AS1, ARMCX2, NXF5, ZMAT1, TCEAL2, TCEAL6, BEX5, AC235565.2, TMSB15A, ARMCX5, AL035427.1, GPRASP1, GPRASP2, BHLHB9, LINC00630, Z68871.1, RAB40AL, Z95624.1, BEX1, NXF3, BEX4, TCEAL8, TCEAL5, BEX2, TCEAL7, TCEAL9, BEX3, AL606763.1, Z69733.1, RAB40A, TCEAL4, TCEAL3, TCEAL3-AS1","DIAPH2, BTK, HNRNPH2, ARMCX3, ZMAT1, BEX4, TCEAL8, BEX2, TCEAL9, BEX3, TCEAL4, TCEAL3",62.0,12.0,"observed in demux_28_11_21_1, but not in demux_n_04_12_23_1. the number of genes we consider is very small, so maybe it is form of regional transcriptional regulation?",,,True,False,False,False,False,False,False,False,False,False,False,False,False,False,False,False,False,False,False,False,False,False,False,False,False,False,False,False,False,False,False,False,False,False,False,False,False,False,False,False,False,False,False,False,False,False,False,False,False,False,False,False,False,False,False,False,False,False,False,False,False,False,False,False,False,False,False,False,False,False,False,False,False,False,False,False,93673568.0,103626492.0,False
N200,demux_11_04_21_2_illumina,N200_del_3p_end_and_3q_start_demux_11_04_21_2_illumina,3,False,KIAA1143,SPICE1,"KIAA1143, KIF15, TMEM42, TGM4, ZDHHC3, EXOSC7, CLEC3B, CDCP1, TMEM158, LARS2, LARS2-AS1, LIMD1, SACM1L, SLC6A20, LZTFL1, CCR9, FYCO1, CXCR6, XCR1, CCR3, CCR1, CCR2, AC098613.1, CCR5, CCRL2, LINC02009, LTF, RTP3, LRRC2, LRRC2-AS1, TDGF1, FAM240A, ALS2CL, TMIE, PRSS50---1, PRSS45, AC109583.3, PRSS42, MYL3, PTH1R, CCDC12, NBEAL2, SETD2, KIF9-AS1, KIF9, KLHL18, AC099778.1, PTPN23, SCAP, ELP6, CSPG5, SMARCC1, DHX30, MAP4, CDC25A, CAMP, ZNF589, NME6, SPINK8, FBXW12, PLXNB1, CCDC51, TMA7, AC134772.1, ATRIP, TREX1, SHISA5, PFKFB4, UCN2, COL7A1, UQCRC1, TMEM89, SLC26A6, CELSR3, LINC02585, AC141002.1, NCKIPSD, IP6K2, PRKAR2A, PRKAR2A-AS1, SLC25A20, ARIH2OS, ARIH2, AC137630.2, AC137630.1, AC137630.4, P4HTM, WDR6, DALRD3, NDUFAF3, IMPDH2, AC137630.3, QRICH1, QARS, USP19, LAMB2, CCDC71, KLHDC8B, CCDC36, AC121247.1, C3orf62, USP4, RHOA, TCTA, AMT, AC104452.1, NICN1, DAG1, BSN-DT, BSN, BSN-AS1, APEH, MST1, RNF123, AMIGO3, GMPPB, IP6K1, CDHR4, INKA1, UBA7, TRAIP, CAMKV, MST1R, AC105935.1, MON1A, RBM6, RBM5, RBM5-AS1, SEMA3F-AS1, SEMA3F, GNAT1, SLC38A3, GNAI2, U73166.1, SEMA3B-AS1, SEMA3B, LSMEM2, IFRD2, HYAL3, NAA80, HYAL1, HYAL2, TUSC2, RASSF1, RASSF1-AS1, ZMYND10-AS1, ZMYND10, NPRL2, CYB561D2, TMEM115, CACNA2D2, CYB561D2---1, C3orf18, HEMK1, AC096920.1, CISH, MAPKAPK3, LINC02019, DOCK3, MANF, RBM15B, DCAF1, RAD54L2, TEX264, GRM2, IQCF1, RRP9, PARP3, GPR62, PCBP4, ABHD14B, ABHD14A, ABHD14A-ACY1, ACY1, RPL29, DUSP7, POC1A, ALAS1, TLR9, TWF2, AC006252.1, PPM1M, WDR82, GLYCTK, DNAH1, BAP1, PHF7, SEMA3G, TNNC1, NISCH, STAB1, NT5DC2, SMIM4, PBRM1, GNL3, GLT8D1, SPCS1, NEK4, ITIH1, ITIH3, ITIH4, AC006254.1, ITIH4-AS1, MUSTN1, TMEM110-MUSTN1, STIMATE, SFMBT1, AC096887.1, RFT1, PRKCD, TKT, DCP1A, CACNA1D, AC012467.1, CHDH, IL17RB, AC012467.2, ACTR8, SELENOK, CACNA2D3, LRTM1, AC121764.2, WNT5A, WNT5A-AS1, AC121764.1, ERC2, AC025572.1, CCDC66, FAM208A, ARHGEF3, SPATA12, AC097358.2, IL17RD, HESX1, APPL1, ASB14, DNAH12, PDE12, ARF4, ARF4-AS1, DENND6A, DENND6A-AS1, DENND6A-DT, SLMAP, FLNB, FLNB-AS1, AC137936.1, DNASE1L3, ABHD6, RPP14, HTD2, AC098479.1, PXK, PDHB, AC135507.1, AC116036.2, KCTD6, ACOX2, FAM107A, AC119424.1, FAM3D-AS1, FAM3D, C3orf67, C3orf67-AS1, AC114400.1, FHIT, PTPRG, C3orf14, CADPS, LINC00698, SYNPR, C3orf49, THOC7, THOC7-AS1, ATXN7, ATXN7---1, SCAANT1, PSMD6-AS2, AC012557.1, PSMD6, PSMD6-AS1, AC012557.2, AC092040.1, LINC00994, PRICKLE2, PRICKLE2-AS3, ADAMTS9, ADAMTS9-AS1, ADAMTS9-AS2, LINC02040, MAGI1, SLC25A26, LRIG1, KBTBD8, AC114401.1, SUCLG2, SUCLG2-AS1, FAM19A1, FAM19A4, EOGT, AC109587.1, TMF1, UBA3, ARL6IP5, LMOD3, FRMD4B, MITF, SAMMSON, FOXP1, FOXP1-AS1, AC097634.2, AC097634.3, AC097634.1, EIF4E3, GPR27, PROK2, LINC00877, AC105265.4, LINC00870, AC112219.2, AC112219.1, AC134508.1, RYBP, AC104435.2, SHQ1, GXYLT2, PPP4R2, EBLN2, PDZRN3, PDZRN3-AS1, CNTN3, LINC02018, FRG2C, LINC00960, ZNF717, ROBO2, LINC02077, ROBO1, AC068756.1, LINC02050, LINC02027, AC099542.2, AC099542.1, GBE1, AC017015.2, AC129807.1, LINC02008, LINC00971, CADM2, CADM2-AS2, CADM2-AS1, VGLL3, AC107204.1, CHMP2B, POU1F1, AC117513.1, HTR1F, CGGBP1, ZNF654, C3orf38, CSNKA2IP, EPHA3, PROS1, ARL13B, STX19, DHFR2, NSUN3, MTRNR2L12, EPHA6, AC110491.1, ARL6, AC110491.3, CRYBG3, AC110491.2, RIOX2, GABRR3, OR5H1, OR5H14, AC117473.1, OR5H6, OR5H2, OR5K4, OR5K3, OR5K1, OR5K2, CLDND1, CPOX, AC021660.2, GPR15, ST3GAL6-AS1, ST3GAL6, DCBLD2, AC091212.1, LINC00973, AC107029.2, COL8A1, AC069222.1, CMSS1, FILIP1L, TBC1D23, NIT2, TOMM70, LNP1, TMEM45A, ADGRG7, TFG, ABI3BP, IMPG2, SENP7, TRMT10C, PCNP, ZBTB11, ZBTB11-AS1, RPL24, CEP97, NXPE3, AC020651.1, NFKBIZ, LINC02085, AC106712.1, ZPLD1, ALCAM, CBLB, LINC00882, DUBR, AC063944.1, AC063944.3, CCDC54, LINC01990, BBX, LINC00635, LINC00636, CD47, LINC01215, IFT57, HHLA2, MYH15, CIP2A, DZIP3, TRAT1, GUCA1C, MORC1, MORC1-AS1, C3orf85, AC063923.2, LINC00488, DPPA2, DPPA4, LINC01205, AC078980.1, NECTIN3-AS1, NECTIN3, CD96, ZBED2, PLCXD2, PLCXD2-AS1, PHLDB2, ABHD10, TAGLN3, TMPRSS7, C3orf52, GCSAM, AC128688.2, SLC9C1, AC112487.1, CD200, AC092894.1, BTLA, ATG3, SLC35A5, CCDC80, LINC02042, CD200R1L, CD200R1, AC074044.1, GTPBP8, NEPRO, AC078785.1, AC078785.2, LINC02044, BOC, CFAP44, CFAP44-AS1, SPICE1","KIAA1143, SACM1L, CCDC12, SETD2, SMARCC1, DHX30, MAP4, TMA7, UQCRC1, IP6K2, ARIH2, WDR6, NDUFAF3, IMPDH2, QARS, RHOA, INKA1, RBM6, RBM5, GNAI2, RASSF1, MAPKAPK3, ABHD14B, RPL29, WDR82, PBRM1, GNL3, SPCS1, TKT, SELENOK, CCDC66, FAM208A, APPL1, ARF4, PDHB, THOC7, PSMD6, TMF1, FRMD4B, FOXP1, RYBP, PPP4R2, CHMP2B, HTR1F, CGGBP1, NIT2, TOMM70, TFG, SENP7, TRMT10C, PCNP, RPL24, NFKBIZ, BBX, CD47, IFT57, DPPA4, ATG3",484.0,58.0,,,,True,False,False,False,False,False,False,False,False,False,False,False,False,False,False,False,False,False,False,False,False,False,False,False,False,False,True,True,False,False,False,False,False,False,False,False,False,False,False,False,False,False,False,False,False,False,False,False,False,False,False,False,False,False,False,False,False,False,False,False,False,False,False,False,False,False,False,False,False,False,False,False,False,False,False,False,44761662.0,113515187.0,False
N200,demux_11_04_21_2,N200_del_3p_end_and_3q_start_demux_11_04_21_2,3,False,KIAA1143,SPICE1,"KIAA1143, KIF15, TMEM42, TGM4, ZDHHC3, EXOSC7, CLEC3B, CDCP1, TMEM158, LARS2, LARS2-AS1, LIMD1, SACM1L, SLC6A20, LZTFL1, CCR9, FYCO1, CXCR6, XCR1, CCR3, CCR1, CCR2, AC098613.1, CCR5, CCRL2, LINC02009, LTF, RTP3, LRRC2, LRRC2-AS1, TDGF1, FAM240A, ALS2CL, TMIE, PRSS50---1, PRSS45, AC109583.3, PRSS42, MYL3, PTH1R, CCDC12, NBEAL2, SETD2, KIF9-AS1, KIF9, KLHL18, AC099778.1, PTPN23, SCAP, ELP6, CSPG5, SMARCC1, DHX30, MAP4, CDC25A, CAMP, ZNF589, NME6, SPINK8, FBXW12, PLXNB1, CCDC51, TMA7, AC134772.1, ATRIP, TREX1, SHISA5, PFKFB4, UCN2, COL7A1, UQCRC1, TMEM89, SLC26A6, CELSR3, LINC02585, AC141002.1, NCKIPSD, IP6K2, PRKAR2A, PRKAR2A-AS1, SLC25A20, ARIH2OS, ARIH2, AC137630.2, AC137630.1, AC137630.4, P4HTM, WDR6, DALRD3, NDUFAF3, IMPDH2, AC137630.3, QRICH1, QARS, USP19, LAMB2, CCDC71, KLHDC8B, CCDC36, AC121247.1, C3orf62, USP4, RHOA, TCTA, AMT, AC104452.1, NICN1, DAG1, BSN-DT, BSN, BSN-AS1, APEH, MST1, RNF123, AMIGO3, GMPPB, IP6K1, CDHR4, INKA1, UBA7, TRAIP, CAMKV, MST1R, AC105935.1, MON1A, RBM6, RBM5, RBM5-AS1, SEMA3F-AS1, SEMA3F, GNAT1, SLC38A3, GNAI2, U73166.1, SEMA3B-AS1, SEMA3B, LSMEM2, IFRD2, HYAL3, NAA80, HYAL1, HYAL2, TUSC2, RASSF1, RASSF1-AS1, ZMYND10-AS1, ZMYND10, NPRL2, CYB561D2, TMEM115, CACNA2D2, CYB561D2---1, C3orf18, HEMK1, AC096920.1, CISH, MAPKAPK3, LINC02019, DOCK3, MANF, RBM15B, DCAF1, RAD54L2, TEX264, GRM2, IQCF1, RRP9, PARP3, GPR62, PCBP4, ABHD14B, ABHD14A, ABHD14A-ACY1, ACY1, RPL29, DUSP7, POC1A, ALAS1, TLR9, TWF2, AC006252.1, PPM1M, WDR82, GLYCTK, DNAH1, BAP1, PHF7, SEMA3G, TNNC1, NISCH, STAB1, NT5DC2, SMIM4, PBRM1, GNL3, GLT8D1, SPCS1, NEK4, ITIH1, ITIH3, ITIH4, AC006254.1, ITIH4-AS1, MUSTN1, TMEM110-MUSTN1, STIMATE, SFMBT1, AC096887.1, RFT1, PRKCD, TKT, DCP1A, CACNA1D, AC012467.1, CHDH, IL17RB, AC012467.2, ACTR8, SELENOK, CACNA2D3, LRTM1, AC121764.2, WNT5A, WNT5A-AS1, AC121764.1, ERC2, AC025572.1, CCDC66, FAM208A, ARHGEF3, SPATA12, AC097358.2, IL17RD, HESX1, APPL1, ASB14, DNAH12, PDE12, ARF4, ARF4-AS1, DENND6A, DENND6A-AS1, DENND6A-DT, SLMAP, FLNB, FLNB-AS1, AC137936.1, DNASE1L3, ABHD6, RPP14, HTD2, AC098479.1, PXK, PDHB, AC135507.1, AC116036.2, KCTD6, ACOX2, FAM107A, AC119424.1, FAM3D-AS1, FAM3D, C3orf67, C3orf67-AS1, AC114400.1, FHIT, PTPRG, C3orf14, CADPS, LINC00698, SYNPR, C3orf49, THOC7, THOC7-AS1, ATXN7, ATXN7---1, SCAANT1, PSMD6-AS2, AC012557.1, PSMD6, PSMD6-AS1, AC012557.2, AC092040.1, LINC00994, PRICKLE2, PRICKLE2-AS3, ADAMTS9, ADAMTS9-AS1, ADAMTS9-AS2, LINC02040, MAGI1, SLC25A26, LRIG1, KBTBD8, AC114401.1, SUCLG2, SUCLG2-AS1, FAM19A1, FAM19A4, EOGT, AC109587.1, TMF1, UBA3, ARL6IP5, LMOD3, FRMD4B, MITF, SAMMSON, FOXP1, FOXP1-AS1, AC097634.2, AC097634.3, AC097634.1, EIF4E3, GPR27, PROK2, LINC00877, AC105265.4, LINC00870, AC112219.2, AC112219.1, AC134508.1, RYBP, AC104435.2, SHQ1, GXYLT2, PPP4R2, EBLN2, PDZRN3, PDZRN3-AS1, CNTN3, LINC02018, FRG2C, LINC00960, ZNF717, ROBO2, LINC02077, ROBO1, AC068756.1, LINC02050, LINC02027, AC099542.2, AC099542.1, GBE1, AC017015.2, AC129807.1, LINC02008, LINC00971, CADM2, CADM2-AS2, CADM2-AS1, VGLL3, AC107204.1, CHMP2B, POU1F1, AC117513.1, HTR1F, CGGBP1, ZNF654, C3orf38, CSNKA2IP, EPHA3, PROS1, ARL13B, STX19, DHFR2, NSUN3, MTRNR2L12, EPHA6, AC110491.1, ARL6, AC110491.3, CRYBG3, AC110491.2, RIOX2, GABRR3, OR5H1, OR5H14, AC117473.1, OR5H6, OR5H2, OR5K4, OR5K3, OR5K1, OR5K2, CLDND1, CPOX, AC021660.2, GPR15, ST3GAL6-AS1, ST3GAL6, DCBLD2, AC091212.1, LINC00973, AC107029.2, COL8A1, AC069222.1, CMSS1, FILIP1L, TBC1D23, NIT2, TOMM70, LNP1, TMEM45A, ADGRG7, TFG, ABI3BP, IMPG2, SENP7, TRMT10C, PCNP, ZBTB11, ZBTB11-AS1, RPL24, CEP97, NXPE3, AC020651.1, NFKBIZ, LINC02085, AC106712.1, ZPLD1, ALCAM, CBLB, LINC00882, DUBR, AC063944.1, AC063944.3, CCDC54, LINC01990, BBX, LINC00635, LINC00636, CD47, LINC01215, IFT57, HHLA2, MYH15, CIP2A, DZIP3, TRAT1, GUCA1C, MORC1, MORC1-AS1, C3orf85, AC063923.2, LINC00488, DPPA2, DPPA4, LINC01205, AC078980.1, NECTIN3-AS1, NECTIN3, CD96, ZBED2, PLCXD2, PLCXD2-AS1, PHLDB2, ABHD10, TAGLN3, TMPRSS7, C3orf52, GCSAM, AC128688.2, SLC9C1, AC112487.1, CD200, AC092894.1, BTLA, ATG3, SLC35A5, CCDC80, LINC02042, CD200R1L, CD200R1, AC074044.1, GTPBP8, NEPRO, AC078785.1, AC078785.2, LINC02044, BOC, CFAP44, CFAP44-AS1, SPICE1","KIAA1143, SACM1L, CCDC12, SETD2, SMARCC1, DHX30, MAP4, TMA7, UQCRC1, IP6K2, ARIH2, WDR6, NDUFAF3, IMPDH2, QARS, RHOA, INKA1, RBM6, RBM5, GNAI2, RASSF1, MAPKAPK3, ABHD14B, RPL29, WDR82, PBRM1, GNL3, SPCS1, TKT, SELENOK, CCDC66, FAM208A, APPL1, ARF4, PDHB, THOC7, PSMD6, TMF1, FRMD4B, FOXP1, RYBP, PPP4R2, CHMP2B, HTR1F, CGGBP1, NIT2, TOMM70, TFG, SENP7, TRMT10C, PCNP, RPL24, NFKBIZ, BBX, CD47, IFT57, DPPA4, ATG3",484.0,58.0,,,,True,False,False,False,False,False,False,False,False,False,False,False,False,False,False,False,False,False,False,False,False,False,False,False,False,False,True,True,False,False,False,False,False,False,False,False,False,False,False,False,False,False,False,False,False,False,False,False,False,False,False,False,False,False,False,False,False,False,False,False,False,False,False,False,False,False,False,False,False,False,False,False,False,False,False,False,44761662.0,113515187.0,False
N200,demux_10_01_22_1,N200_del_3p_end_and_3q_start_demux_10_01_22_1,3,False,KIAA1143,SPICE1,"KIAA1143, KIF15, TMEM42, TGM4, ZDHHC3, EXOSC7, CLEC3B, CDCP1, TMEM158, LARS2, LARS2-AS1, LIMD1, SACM1L, SLC6A20, LZTFL1, CCR9, FYCO1, CXCR6, XCR1, CCR3, CCR1, CCR2, AC098613.1, CCR5, CCRL2, LINC02009, LTF, RTP3, LRRC2, LRRC2-AS1, TDGF1, FAM240A, ALS2CL, TMIE, PRSS50---1, PRSS45, AC109583.3, PRSS42, MYL3, PTH1R, CCDC12, NBEAL2, SETD2, KIF9-AS1, KIF9, KLHL18, AC099778.1, PTPN23, SCAP, ELP6, CSPG5, SMARCC1, DHX30, MAP4, CDC25A, CAMP, ZNF589, NME6, SPINK8, FBXW12, PLXNB1, CCDC51, TMA7, AC134772.1, ATRIP, TREX1, SHISA5, PFKFB4, UCN2, COL7A1, UQCRC1, TMEM89, SLC26A6, CELSR3, LINC02585, AC141002.1, NCKIPSD, IP6K2, PRKAR2A, PRKAR2A-AS1, SLC25A20, ARIH2OS, ARIH2, AC137630.2, AC137630.1, AC137630.4, P4HTM, WDR6, DALRD3, NDUFAF3, IMPDH2, AC137630.3, QRICH1, QARS, USP19, LAMB2, CCDC71, KLHDC8B, CCDC36, AC121247.1, C3orf62, USP4, RHOA, TCTA, AMT, AC104452.1, NICN1, DAG1, BSN-DT, BSN, BSN-AS1, APEH, MST1, RNF123, AMIGO3, GMPPB, IP6K1, CDHR4, INKA1, UBA7, TRAIP, CAMKV, MST1R, AC105935.1, MON1A, RBM6, RBM5, RBM5-AS1, SEMA3F-AS1, SEMA3F, GNAT1, SLC38A3, GNAI2, U73166.1, SEMA3B-AS1, SEMA3B, LSMEM2, IFRD2, HYAL3, NAA80, HYAL1, HYAL2, TUSC2, RASSF1, RASSF1-AS1, ZMYND10-AS1, ZMYND10, NPRL2, CYB561D2, TMEM115, CACNA2D2, CYB561D2---1, C3orf18, HEMK1, AC096920.1, CISH, MAPKAPK3, LINC02019, DOCK3, MANF, RBM15B, DCAF1, RAD54L2, TEX264, GRM2, IQCF1, RRP9, PARP3, GPR62, PCBP4, ABHD14B, ABHD14A, ABHD14A-ACY1, ACY1, RPL29, DUSP7, POC1A, ALAS1, TLR9, TWF2, AC006252.1, PPM1M, WDR82, GLYCTK, DNAH1, BAP1, PHF7, SEMA3G, TNNC1, NISCH, STAB1, NT5DC2, SMIM4, PBRM1, GNL3, GLT8D1, SPCS1, NEK4, ITIH1, ITIH3, ITIH4, AC006254.1, ITIH4-AS1, MUSTN1, TMEM110-MUSTN1, STIMATE, SFMBT1, AC096887.1, RFT1, PRKCD, TKT, DCP1A, CACNA1D, AC012467.1, CHDH, IL17RB, AC012467.2, ACTR8, SELENOK, CACNA2D3, LRTM1, AC121764.2, WNT5A, WNT5A-AS1, AC121764.1, ERC2, AC025572.1, CCDC66, FAM208A, ARHGEF3, SPATA12, AC097358.2, IL17RD, HESX1, APPL1, ASB14, DNAH12, PDE12, ARF4, ARF4-AS1, DENND6A, DENND6A-AS1, DENND6A-DT, SLMAP, FLNB, FLNB-AS1, AC137936.1, DNASE1L3, ABHD6, RPP14, HTD2, AC098479.1, PXK, PDHB, AC135507.1, AC116036.2, KCTD6, ACOX2, FAM107A, AC119424.1, FAM3D-AS1, FAM3D, C3orf67, C3orf67-AS1, AC114400.1, FHIT, PTPRG, C3orf14, CADPS, LINC00698, SYNPR, C3orf49, THOC7, THOC7-AS1, ATXN7, ATXN7---1, SCAANT1, PSMD6-AS2, AC012557.1, PSMD6, PSMD6-AS1, AC012557.2, AC092040.1, LINC00994, PRICKLE2, PRICKLE2-AS3, ADAMTS9, ADAMTS9-AS1, ADAMTS9-AS2, LINC02040, MAGI1, SLC25A26, LRIG1, KBTBD8, AC114401.1, SUCLG2, SUCLG2-AS1, FAM19A1, FAM19A4, EOGT, AC109587.1, TMF1, UBA3, ARL6IP5, LMOD3, FRMD4B, MITF, SAMMSON, FOXP1, FOXP1-AS1, AC097634.2, AC097634.3, AC097634.1, EIF4E3, GPR27, PROK2, LINC00877, AC105265.4, LINC00870, AC112219.2, AC112219.1, AC134508.1, RYBP, AC104435.2, SHQ1, GXYLT2, PPP4R2, EBLN2, PDZRN3, PDZRN3-AS1, CNTN3, LINC02018, FRG2C, LINC00960, ZNF717, ROBO2, LINC02077, ROBO1, AC068756.1, LINC02050, LINC02027, AC099542.2, AC099542.1, GBE1, AC017015.2, AC129807.1, LINC02008, LINC00971, CADM2, CADM2-AS2, CADM2-AS1, VGLL3, AC107204.1, CHMP2B, POU1F1, AC117513.1, HTR1F, CGGBP1, ZNF654, C3orf38, CSNKA2IP, EPHA3, PROS1, ARL13B, STX19, DHFR2, NSUN3, MTRNR2L12, EPHA6, AC110491.1, ARL6, AC110491.3, CRYBG3, AC110491.2, RIOX2, GABRR3, OR5H1, OR5H14, AC117473.1, OR5H6, OR5H2, OR5K4, OR5K3, OR5K1, OR5K2, CLDND1, CPOX, AC021660.2, GPR15, ST3GAL6-AS1, ST3GAL6, DCBLD2, AC091212.1, LINC00973, AC107029.2, COL8A1, AC069222.1, CMSS1, FILIP1L, TBC1D23, NIT2, TOMM70, LNP1, TMEM45A, ADGRG7, TFG, ABI3BP, IMPG2, SENP7, TRMT10C, PCNP, ZBTB11, ZBTB11-AS1, RPL24, CEP97, NXPE3, AC020651.1, NFKBIZ, LINC02085, AC106712.1, ZPLD1, ALCAM, CBLB, LINC00882, DUBR, AC063944.1, AC063944.3, CCDC54, LINC01990, BBX, LINC00635, LINC00636, CD47, LINC01215, IFT57, HHLA2, MYH15, CIP2A, DZIP3, TRAT1, GUCA1C, MORC1, MORC1-AS1, C3orf85, AC063923.2, LINC00488, DPPA2, DPPA4, LINC01205, AC078980.1, NECTIN3-AS1, NECTIN3, CD96, ZBED2, PLCXD2, PLCXD2-AS1, PHLDB2, ABHD10, TAGLN3, TMPRSS7, C3orf52, GCSAM, AC128688.2, SLC9C1, AC112487.1, CD200, AC092894.1, BTLA, ATG3, SLC35A5, CCDC80, LINC02042, CD200R1L, CD200R1, AC074044.1, GTPBP8, NEPRO, AC078785.1, AC078785.2, LINC02044, BOC, CFAP44, CFAP44-AS1, SPICE1","KIAA1143, SACM1L, CCDC12, SETD2, SMARCC1, DHX30, MAP4, TMA7, UQCRC1, IP6K2, ARIH2, WDR6, NDUFAF3, IMPDH2, QARS, RHOA, INKA1, RBM6, RBM5, GNAI2, RASSF1, MAPKAPK3, ABHD14B, RPL29, WDR82, PBRM1, GNL3, SPCS1, TKT, SELENOK, CCDC66, FAM208A, APPL1, ARF4, PDHB, THOC7, PSMD6, TMF1, FRMD4B, FOXP1, RYBP, PPP4R2, CHMP2B, HTR1F, CGGBP1, NIT2, TOMM70, TFG, SENP7, TRMT10C, PCNP, RPL24, NFKBIZ, BBX, CD47, IFT57, DPPA4, ATG3",484.0,58.0,,,,True,False,False,False,False,False,False,False,False,False,False,False,False,False,False,False,False,False,False,False,False,False,False,False,False,False,True,True,False,False,False,False,False,False,False,False,False,False,False,False,False,False,False,False,False,False,False,False,False,False,False,False,False,False,False,False,False,False,False,False,False,False,False,False,False,False,False,False,False,False,False,False,False,False,False,False,44761662.0,113515187.0,False
